meal_id,actual_id,recipes,ingredients,methods,image,average_rating
63,5cbf3cfda29e122e4c79a988,"bò xào thập cẩm,thịt kho trứng cút,rau muống luộc,canh rau muống chua","Thịt bò phi lê: 250g. Ớt chuông: 1 quả màu đỏ. Dứa: 300g. Hành tây: 1 củ. Bông cải xanh, bông cải trắng: mỗi loại 100g. Cà chua quả chín tới: 1 quả. Hành lá, rau ngò: 100g. Ớt đỏ: 2 quả. Các loại gia vị cần dùng cho món ăn: ớt bột, hạt nêm, bột ngọt, đường, hạt tiêu, hành khô, tỏi, gừng, rượu trắng, dầu ăn, dầu mè, nước mắm||||","Ớt chuông rửa sạch rồi thái miếng dài tầm 1,5cm.; Thịt bò đem rửa cùng nước muối loãng rồi sau đó rửa lại bằng nước sạch. Thái lát mỏng theo thớ ngang để khi ăn thịt sẽ không bị dai.; Bắc chảo lên bếp rồi cho ít dầu ăn vào để phi thơm tỏi, hành băm. Phi một lúc đến khi dậy mùi thì cho ½ thìa ớt bột để tạo màu đẹp mắt cho món ăn. Sau đó các bạn trút thịt bò ướp vào xào cùng trên lửa to trong khoảng 3 phút. Khi thịt bò đã chín tới các bạn tắt bếp, trút luôn ra đĩa để riêng.; Vẫn chiếc chảo đó các bạn phi thơm hành, tỏi băm cùng gừng thái chỉ. Đảo lên vài lượt rồi cho bông cải xanh, bông cải trắng, ớt chuông vào, xào đều tay trong khoảng 1 phút thì nhanh chóng cho tiếp phần dứa, cà chua, hành tây vào xào chung lên. Nêm vào ½ thìa hạt nêm, ½ thìa bột ngọt, ½ thìa dầu mè, ¼ thìa hạt tiêu, 2 thìa nước lọc sao cho vừa khẩu vị ăn.; Xào vài lượt đến khi thấy nguyên liệu đã gần chín tới thì lúc này các bạn đem trút thịt bò vào, đảo lên thật nhanh tay khoảng 1 phút thì rưới lên 1 thìa dầu ăn để tạo độ bóng bẩy đẹp mắt. Cuối cùng là cho hành lá cắt khúc vào, đảo lên lần cuối rồi tắt bếp luôn.; Trình bày món ăn ra đĩa rồi cho rau ngò thái nhỏ và chút hạt tiêu lên. Thưởng thức với cơm nóng sẽ đưa cơm lắm nhé.||||",http://elinerfood.com/wp-content/uploads/2016/05/mam-com-28-365-mam-com-gia-dinh.jpg,3.69
64,5cbf3cfda29e122e4c79a989,"cá kho thịt,canh rau cải nấu thịt băm,rau muống luộc,nước rau muống chua",||||,||||,http://elinerfood.com/wp-content/uploads/2016/05/mam-com-29-365-mam-com-gia-dinh.jpg,3.39
65,5cbf3cfda29e122e4c79a98d,"ba rọi heo cuốn rau củ,trứng tráng cuộn,canh măng nấu móng giò,rau muống xào",||||,||||,http://elinerfood.com/wp-content/uploads/2016/05/mam-com-33-365-mam-com-gia-dinh.jpg,3.32
66,5cbf3cdca29e122e4c79a980,"bê xào xả ớt,tôm chiên xả,rau củ quả luộc,canh khoai sọ hầm xương","Thịt bê loại ngon: 300 gam. Sả: 3 củ. Gừng tươi: 1 củ. Ớt đỏ: 2 quả. Tỏi: 1 củ. Ớt chuông xanh đỏ: mỗi loại 1 quả. Hành hoa: 4 nhánh. Rượu trắng: 1 thìa|||200 gram xương ống (hoặc xương cục đều được). 300 gram khoai sọ. 3 nhánh hành lá. 10 lá ngò gai (rau mùi tàu). Các loại gia vị được sử dụng trong món ăn này: đường, muối, bột ngọt, hạt tiêu…|","|||Xương heo có thể nhờ người bán hàng chặt thành từng khúc cho bạn nhé. Sau đó khi mua về chúng ta đem rửa sạch và để ráo nước.; Đi găng tay ni lông rồi tiến hành gọt vỏ khoai sọ, sau đó đem rửa sạch rồi thái thành những miếng vừa miệng ăn. Các bạn cho khoai ngâm trong nước lạnh có bỏ vào chút muối nhé. Cách làm này vừa giúp cho món ăn của chúng ta thêm ngon, khoai không bị thâm và không bị ngứa nên các chị em hãy lưu ý.; Ngò gai, hành lá lần lượt nhặt rồi rửa sạch, cắt khúc hay thái nhỏ tùy theo ý thích.; Bắc nồi nước lên bếp đun đến sôi thì cho xương heo vào trần qua. Các bạn nhớ cho vào chút gia vị sao vừa miệng ăn.Trong quá trình đun, thỉnh thoảng mở nắp vung để hớt phần bọt nổi lên trên. Khi thấy xương gần chín mềm thì cho khoai sọ vào, hầm đến khi chín nhừ thì nêm nếm lại gia vị cho vừa ăn là có thể tắt bếp.; Múc canh ra bát tô rồi cho vào chút hành lá, ngò gai để tăng mùi thơm cũng như hình thức đẹp mắt cho món ăn.|",http://elinerfood.com/wp-content/uploads/2016/05/mam-com-20-365-mam-com-gia-dinh.jpg,3.0
67,5cbf3cdca29e122e4c79a981,"cá chép xào dưa,trứng chiên cuộn,rau muống luộc,bí xanh luộc","200 gram xương ống (hoặc xương cục đều được). 300 gram khoai sọ. 3 nhánh hành lá. 10 lá ngò gai (rau mùi tàu). Các loại gia vị được sử dụng trong món ăn này: đường, muối, bột ngọt, hạt tiêu…|200 gram xương ống (hoặc xương cục đều được). 300 gram khoai sọ. 3 nhánh hành lá. 10 lá ngò gai (rau mùi tàu). Các loại gia vị được sử dụng trong món ăn này: đường, muối, bột ngọt, hạt tiêu…|200 gram xương ống (hoặc xương cục đều được). 300 gram khoai sọ. 3 nhánh hành lá. 10 lá ngò gai (rau mùi tàu). Các loại gia vị được sử dụng trong món ăn này: đường, muối, bột ngọt, hạt tiêu…|200 gram xương ống (hoặc xương cục đều được). 300 gram khoai sọ. 3 nhánh hành lá. 10 lá ngò gai (rau mùi tàu). Các loại gia vị được sử dụng trong món ăn này: đường, muối, bột ngọt, hạt tiêu…|","Xương heo có thể nhờ người bán hàng chặt thành từng khúc cho bạn nhé. Sau đó khi mua về chúng ta đem rửa sạch và để ráo nước.; Đi găng tay ni lông rồi tiến hành gọt vỏ khoai sọ, sau đó đem rửa sạch rồi thái thành những miếng vừa miệng ăn. Các bạn cho khoai ngâm trong nước lạnh có bỏ vào chút muối nhé. Cách làm này vừa giúp cho món ăn của chúng ta thêm ngon, khoai không bị thâm và không bị ngứa nên các chị em hãy lưu ý.; Ngò gai, hành lá lần lượt nhặt rồi rửa sạch, cắt khúc hay thái nhỏ tùy theo ý thích.; Bắc nồi nước lên bếp đun đến sôi thì cho xương heo vào trần qua. Các bạn nhớ cho vào chút gia vị sao vừa miệng ăn.Trong quá trình đun, thỉnh thoảng mở nắp vung để hớt phần bọt nổi lên trên. Khi thấy xương gần chín mềm thì cho khoai sọ vào, hầm đến khi chín nhừ thì nêm nếm lại gia vị cho vừa ăn là có thể tắt bếp.; Múc canh ra bát tô rồi cho vào chút hành lá, ngò gai để tăng mùi thơm cũng như hình thức đẹp mắt cho món ăn.|Xương heo có thể nhờ người bán hàng chặt thành từng khúc cho bạn nhé. Sau đó khi mua về chúng ta đem rửa sạch và để ráo nước.; Đi găng tay ni lông rồi tiến hành gọt vỏ khoai sọ, sau đó đem rửa sạch rồi thái thành những miếng vừa miệng ăn. Các bạn cho khoai ngâm trong nước lạnh có bỏ vào chút muối nhé. Cách làm này vừa giúp cho món ăn của chúng ta thêm ngon, khoai không bị thâm và không bị ngứa nên các chị em hãy lưu ý.; Ngò gai, hành lá lần lượt nhặt rồi rửa sạch, cắt khúc hay thái nhỏ tùy theo ý thích.; Bắc nồi nước lên bếp đun đến sôi thì cho xương heo vào trần qua. Các bạn nhớ cho vào chút gia vị sao vừa miệng ăn.Trong quá trình đun, thỉnh thoảng mở nắp vung để hớt phần bọt nổi lên trên. Khi thấy xương gần chín mềm thì cho khoai sọ vào, hầm đến khi chín nhừ thì nêm nếm lại gia vị cho vừa ăn là có thể tắt bếp.; Múc canh ra bát tô rồi cho vào chút hành lá, ngò gai để tăng mùi thơm cũng như hình thức đẹp mắt cho món ăn.|Xương heo có thể nhờ người bán hàng chặt thành từng khúc cho bạn nhé. Sau đó khi mua về chúng ta đem rửa sạch và để ráo nước.; Đi găng tay ni lông rồi tiến hành gọt vỏ khoai sọ, sau đó đem rửa sạch rồi thái thành những miếng vừa miệng ăn. Các bạn cho khoai ngâm trong nước lạnh có bỏ vào chút muối nhé. Cách làm này vừa giúp cho món ăn của chúng ta thêm ngon, khoai không bị thâm và không bị ngứa nên các chị em hãy lưu ý.; Ngò gai, hành lá lần lượt nhặt rồi rửa sạch, cắt khúc hay thái nhỏ tùy theo ý thích.; Bắc nồi nước lên bếp đun đến sôi thì cho xương heo vào trần qua. Các bạn nhớ cho vào chút gia vị sao vừa miệng ăn.Trong quá trình đun, thỉnh thoảng mở nắp vung để hớt phần bọt nổi lên trên. Khi thấy xương gần chín mềm thì cho khoai sọ vào, hầm đến khi chín nhừ thì nêm nếm lại gia vị cho vừa ăn là có thể tắt bếp.; Múc canh ra bát tô rồi cho vào chút hành lá, ngò gai để tăng mùi thơm cũng như hình thức đẹp mắt cho món ăn.|Xương heo có thể nhờ người bán hàng chặt thành từng khúc cho bạn nhé. Sau đó khi mua về chúng ta đem rửa sạch và để ráo nước.; Đi găng tay ni lông rồi tiến hành gọt vỏ khoai sọ, sau đó đem rửa sạch rồi thái thành những miếng vừa miệng ăn. Các bạn cho khoai ngâm trong nước lạnh có bỏ vào chút muối nhé. Cách làm này vừa giúp cho món ăn của chúng ta thêm ngon, khoai không bị thâm và không bị ngứa nên các chị em hãy lưu ý.; Ngò gai, hành lá lần lượt nhặt rồi rửa sạch, cắt khúc hay thái nhỏ tùy theo ý thích.; Bắc nồi nước lên bếp đun đến sôi thì cho xương heo vào trần qua. Các bạn nhớ cho vào chút gia vị sao vừa miệng ăn.Trong quá trình đun, thỉnh thoảng mở nắp vung để hớt phần bọt nổi lên trên. Khi thấy xương gần chín mềm thì cho khoai sọ vào, hầm đến khi chín nhừ thì nêm nếm lại gia vị cho vừa ăn là có thể tắt bếp.; Múc canh ra bát tô rồi cho vào chút hành lá, ngò gai để tăng mùi thơm cũng như hình thức đẹp mắt cho món ăn.|",http://elinerfood.com/wp-content/uploads/2016/05/mam-com-21-365-mam-com-gia-dinh.jpg,3.03
68,5cbf3d07a29e122e4c79a995,"chả đậu,gà om xì dầu,canh mướp nấu thịt,súp lơ luộc","Tôm nõn hoặc tôm tươi. Bầu: 1 quả vừa. Hành tươi, rau mùi. Các loại gia vị cần dùng cho món ăn: nước mắm, hạt nêm, đường|Tôm nõn hoặc tôm tươi. Bầu: 1 quả vừa. Hành tươi, rau mùi. Các loại gia vị cần dùng cho món ăn: nước mắm, hạt nêm, đường|Tôm nõn hoặc tôm tươi. Bầu: 1 quả vừa. Hành tươi, rau mùi. Các loại gia vị cần dùng cho món ăn: nước mắm, hạt nêm, đường|Tôm nõn hoặc tôm tươi. Bầu: 1 quả vừa. Hành tươi, rau mùi. Các loại gia vị cần dùng cho món ăn: nước mắm, hạt nêm, đường|","Trước tiên, tôm mua về các bạn hãy để vào ngăn đông tủ lạnh khoảng 1 tiếng rồi lấy ra sẽ dễ lột vỏ hơn nhé. Chú ý giữ lại phần đầu và râu tôm. Hoặc không các bạn có thể mua tôm nõn sẽ không cần phải bóc vỏ đều được.; Để có được món ăn ngon chuẩn thì khi đi chợ các bạn nên nhớ chọn mua quả bầu không quá già hay quá non nhé. Hoặc có thể bạn lấy móng tay bấm vào quả bầu nếu thấy vừa phải không bị cứng cũng không quá mềm thì đây chính là quả bầu ngon ngọt các bạn nhé. Mua về chúng ta đem gọt sạch vỏ rồi rửa sạch, thái thành những miếng vừa ăn.; Hành và rau mùi các bạn nhặt, rửa sạch rồi thái nhỏ.; Đặt nồi nấu canh lên bếp rồi cho vào phần hành để phi thơm lên. Tiếp tục cho tôm vào đảo cùng đến khi tôm chín vàng thì nhanh tay cho thêm bầu. Nêm vào 1 thìa hạt nêm rồi đảo đều tay đến khi thấy bầu chín tái thì đổ vào lượng nước nóng để nấu canh sao cho vừa với khẩu phần ăn của cả nhà. Đun đến sôi thì các bạn cho hành mùi thái nhỏ vào là tắt bếp được luôn.|Trước tiên, tôm mua về các bạn hãy để vào ngăn đông tủ lạnh khoảng 1 tiếng rồi lấy ra sẽ dễ lột vỏ hơn nhé. Chú ý giữ lại phần đầu và râu tôm. Hoặc không các bạn có thể mua tôm nõn sẽ không cần phải bóc vỏ đều được.; Để có được món ăn ngon chuẩn thì khi đi chợ các bạn nên nhớ chọn mua quả bầu không quá già hay quá non nhé. Hoặc có thể bạn lấy móng tay bấm vào quả bầu nếu thấy vừa phải không bị cứng cũng không quá mềm thì đây chính là quả bầu ngon ngọt các bạn nhé. Mua về chúng ta đem gọt sạch vỏ rồi rửa sạch, thái thành những miếng vừa ăn.; Hành và rau mùi các bạn nhặt, rửa sạch rồi thái nhỏ.; Đặt nồi nấu canh lên bếp rồi cho vào phần hành để phi thơm lên. Tiếp tục cho tôm vào đảo cùng đến khi tôm chín vàng thì nhanh tay cho thêm bầu. Nêm vào 1 thìa hạt nêm rồi đảo đều tay đến khi thấy bầu chín tái thì đổ vào lượng nước nóng để nấu canh sao cho vừa với khẩu phần ăn của cả nhà. Đun đến sôi thì các bạn cho hành mùi thái nhỏ vào là tắt bếp được luôn.|Trước tiên, tôm mua về các bạn hãy để vào ngăn đông tủ lạnh khoảng 1 tiếng rồi lấy ra sẽ dễ lột vỏ hơn nhé. Chú ý giữ lại phần đầu và râu tôm. Hoặc không các bạn có thể mua tôm nõn sẽ không cần phải bóc vỏ đều được.; Để có được món ăn ngon chuẩn thì khi đi chợ các bạn nên nhớ chọn mua quả bầu không quá già hay quá non nhé. Hoặc có thể bạn lấy móng tay bấm vào quả bầu nếu thấy vừa phải không bị cứng cũng không quá mềm thì đây chính là quả bầu ngon ngọt các bạn nhé. Mua về chúng ta đem gọt sạch vỏ rồi rửa sạch, thái thành những miếng vừa ăn.; Hành và rau mùi các bạn nhặt, rửa sạch rồi thái nhỏ.; Đặt nồi nấu canh lên bếp rồi cho vào phần hành để phi thơm lên. Tiếp tục cho tôm vào đảo cùng đến khi tôm chín vàng thì nhanh tay cho thêm bầu. Nêm vào 1 thìa hạt nêm rồi đảo đều tay đến khi thấy bầu chín tái thì đổ vào lượng nước nóng để nấu canh sao cho vừa với khẩu phần ăn của cả nhà. Đun đến sôi thì các bạn cho hành mùi thái nhỏ vào là tắt bếp được luôn.|Trước tiên, tôm mua về các bạn hãy để vào ngăn đông tủ lạnh khoảng 1 tiếng rồi lấy ra sẽ dễ lột vỏ hơn nhé. Chú ý giữ lại phần đầu và râu tôm. Hoặc không các bạn có thể mua tôm nõn sẽ không cần phải bóc vỏ đều được.; Để có được món ăn ngon chuẩn thì khi đi chợ các bạn nên nhớ chọn mua quả bầu không quá già hay quá non nhé. Hoặc có thể bạn lấy móng tay bấm vào quả bầu nếu thấy vừa phải không bị cứng cũng không quá mềm thì đây chính là quả bầu ngon ngọt các bạn nhé. Mua về chúng ta đem gọt sạch vỏ rồi rửa sạch, thái thành những miếng vừa ăn.; Hành và rau mùi các bạn nhặt, rửa sạch rồi thái nhỏ.; Đặt nồi nấu canh lên bếp rồi cho vào phần hành để phi thơm lên. Tiếp tục cho tôm vào đảo cùng đến khi tôm chín vàng thì nhanh tay cho thêm bầu. Nêm vào 1 thìa hạt nêm rồi đảo đều tay đến khi thấy bầu chín tái thì đổ vào lượng nước nóng để nấu canh sao cho vừa với khẩu phần ăn của cả nhà. Đun đến sôi thì các bạn cho hành mùi thái nhỏ vào là tắt bếp được luôn.|",http://elinerfood.com/wp-content/uploads/2016/05/mam-com-41-365-mam-com-gia-dinh.jpg,3.45
69,5cbf3d02a29e122e4c79a990,"mướp xào tim lợn,lưỡi lợn xào thập cẩm,canh cải thảo thịt bò,đậu phụ sống",||||,||||,http://elinerfood.com/wp-content/uploads/2016/05/mam-com-36-365-mam-com-gia-dinh.jpg,3.42
70,5cbf3cfda29e122e4c79a98e,"mực trứng hấp xả,đậu phụ rán,hoa bí xào tỏi,canh rau cải nấu thịt",||||,||||,http://elinerfood.com/wp-content/uploads/2016/05/mam-com-34-365-mam-com-gia-dinh.jpg,3.48
71,5cbf3d0ba29e122e4c79a99c,"cá nục kho,mực chiên giòn,chả rán,canh mồng tơi nấu tôm","Tôm nõn hoặc tôm tươi. Bầu: 1 quả vừa. Hành tươi, rau mùi. Các loại gia vị cần dùng cho món ăn: nước mắm, hạt nêm, đường|Tôm nõn hoặc tôm tươi. Bầu: 1 quả vừa. Hành tươi, rau mùi. Các loại gia vị cần dùng cho món ăn: nước mắm, hạt nêm, đường|Tôm nõn hoặc tôm tươi. Bầu: 1 quả vừa. Hành tươi, rau mùi. Các loại gia vị cần dùng cho món ăn: nước mắm, hạt nêm, đường|Tôm nõn hoặc tôm tươi. Bầu: 1 quả vừa. Hành tươi, rau mùi. Các loại gia vị cần dùng cho món ăn: nước mắm, hạt nêm, đường|","Trước tiên, tôm mua về các bạn hãy để vào ngăn đông tủ lạnh khoảng 1 tiếng rồi lấy ra sẽ dễ lột vỏ hơn nhé. Chú ý giữ lại phần đầu và râu tôm. Hoặc không các bạn có thể mua tôm nõn sẽ không cần phải bóc vỏ đều được.; Để có được món ăn ngon chuẩn thì khi đi chợ các bạn nên nhớ chọn mua quả bầu không quá già hay quá non nhé. Hoặc có thể bạn lấy móng tay bấm vào quả bầu nếu thấy vừa phải không bị cứng cũng không quá mềm thì đây chính là quả bầu ngon ngọt các bạn nhé. Mua về chúng ta đem gọt sạch vỏ rồi rửa sạch, thái thành những miếng vừa ăn.; Hành và rau mùi các bạn nhặt, rửa sạch rồi thái nhỏ.; Đặt nồi nấu canh lên bếp rồi cho vào phần hành để phi thơm lên. Tiếp tục cho tôm vào đảo cùng đến khi tôm chín vàng thì nhanh tay cho thêm bầu. Nêm vào 1 thìa hạt nêm rồi đảo đều tay đến khi thấy bầu chín tái thì đổ vào lượng nước nóng để nấu canh sao cho vừa với khẩu phần ăn của cả nhà. Đun đến sôi thì các bạn cho hành mùi thái nhỏ vào là tắt bếp được luôn.|Trước tiên, tôm mua về các bạn hãy để vào ngăn đông tủ lạnh khoảng 1 tiếng rồi lấy ra sẽ dễ lột vỏ hơn nhé. Chú ý giữ lại phần đầu và râu tôm. Hoặc không các bạn có thể mua tôm nõn sẽ không cần phải bóc vỏ đều được.; Để có được món ăn ngon chuẩn thì khi đi chợ các bạn nên nhớ chọn mua quả bầu không quá già hay quá non nhé. Hoặc có thể bạn lấy móng tay bấm vào quả bầu nếu thấy vừa phải không bị cứng cũng không quá mềm thì đây chính là quả bầu ngon ngọt các bạn nhé. Mua về chúng ta đem gọt sạch vỏ rồi rửa sạch, thái thành những miếng vừa ăn.; Hành và rau mùi các bạn nhặt, rửa sạch rồi thái nhỏ.; Đặt nồi nấu canh lên bếp rồi cho vào phần hành để phi thơm lên. Tiếp tục cho tôm vào đảo cùng đến khi tôm chín vàng thì nhanh tay cho thêm bầu. Nêm vào 1 thìa hạt nêm rồi đảo đều tay đến khi thấy bầu chín tái thì đổ vào lượng nước nóng để nấu canh sao cho vừa với khẩu phần ăn của cả nhà. Đun đến sôi thì các bạn cho hành mùi thái nhỏ vào là tắt bếp được luôn.|Trước tiên, tôm mua về các bạn hãy để vào ngăn đông tủ lạnh khoảng 1 tiếng rồi lấy ra sẽ dễ lột vỏ hơn nhé. Chú ý giữ lại phần đầu và râu tôm. Hoặc không các bạn có thể mua tôm nõn sẽ không cần phải bóc vỏ đều được.; Để có được món ăn ngon chuẩn thì khi đi chợ các bạn nên nhớ chọn mua quả bầu không quá già hay quá non nhé. Hoặc có thể bạn lấy móng tay bấm vào quả bầu nếu thấy vừa phải không bị cứng cũng không quá mềm thì đây chính là quả bầu ngon ngọt các bạn nhé. Mua về chúng ta đem gọt sạch vỏ rồi rửa sạch, thái thành những miếng vừa ăn.; Hành và rau mùi các bạn nhặt, rửa sạch rồi thái nhỏ.; Đặt nồi nấu canh lên bếp rồi cho vào phần hành để phi thơm lên. Tiếp tục cho tôm vào đảo cùng đến khi tôm chín vàng thì nhanh tay cho thêm bầu. Nêm vào 1 thìa hạt nêm rồi đảo đều tay đến khi thấy bầu chín tái thì đổ vào lượng nước nóng để nấu canh sao cho vừa với khẩu phần ăn của cả nhà. Đun đến sôi thì các bạn cho hành mùi thái nhỏ vào là tắt bếp được luôn.|Trước tiên, tôm mua về các bạn hãy để vào ngăn đông tủ lạnh khoảng 1 tiếng rồi lấy ra sẽ dễ lột vỏ hơn nhé. Chú ý giữ lại phần đầu và râu tôm. Hoặc không các bạn có thể mua tôm nõn sẽ không cần phải bóc vỏ đều được.; Để có được món ăn ngon chuẩn thì khi đi chợ các bạn nên nhớ chọn mua quả bầu không quá già hay quá non nhé. Hoặc có thể bạn lấy móng tay bấm vào quả bầu nếu thấy vừa phải không bị cứng cũng không quá mềm thì đây chính là quả bầu ngon ngọt các bạn nhé. Mua về chúng ta đem gọt sạch vỏ rồi rửa sạch, thái thành những miếng vừa ăn.; Hành và rau mùi các bạn nhặt, rửa sạch rồi thái nhỏ.; Đặt nồi nấu canh lên bếp rồi cho vào phần hành để phi thơm lên. Tiếp tục cho tôm vào đảo cùng đến khi tôm chín vàng thì nhanh tay cho thêm bầu. Nêm vào 1 thìa hạt nêm rồi đảo đều tay đến khi thấy bầu chín tái thì đổ vào lượng nước nóng để nấu canh sao cho vừa với khẩu phần ăn của cả nhà. Đun đến sôi thì các bạn cho hành mùi thái nhỏ vào là tắt bếp được luôn.|",http://elinerfood.com/wp-content/uploads/2016/05/mam-com-48-365-mam-com-gia-dinh.jpg,3.18
72,5cbf3d18a29e122e4c79a99f,"chả cá sốt cà chua,tôm rang,canh dưa cà chua,rau muống luộc,cà pháo","|Tôm tươi: 3 lạng (chúy ý chọn những con tôm còn tươi). Hành, tỏi khô, hành lá. Các loại gia vị cần dùng cho món ăn: 1 thìa canh nước mắm, 2 thìa cà phê đường, 1 thìa cà phê bột ngọt, hạt tiêu, dầu ăn||||","|Tôm mua về rửa sạch rồi thực hiện cắt bỏ phần râu và đầu nhọn của tôm. Tiếp đến dùng chút muối để xóc đều lên trong khoảng 15 phút để có được món ăn đậm đà hơn nhé.; Bắc chảo lên bếp rồi cho vào chảo 1 thìa cà phê đường, đun đến khi đường tan chảy hoàn toàn chuyển snag màu nâu cánh gián đẹp mắt thì thêm vào 2 thìa canh nước lọc, tiếp tục đun sôi.; Hành lá nhặt rồi rửa sạch, thái nhỏ.; Trình bày món ăn ra đĩa rồi rắc chút hạt tiêu lên trên và thưởng thức luôn nhé.||||",http://elinerfood.com/wp-content/uploads/2016/05/mam-com-51-365-mam-com-gia-dinh.jpg,3.66
