meal_id,actual_id,recipes,ingredients,methods,image,average_rating
93,5cbf3d1ca29e122e4c79a9a4,"cá cơm chiên ròn,thịt quay giòn bì,rau muống xào tỏi,canh mướp đắng nhồi thịt","1 cái hoa chuối. 1,5 lạng thịt gà (nên chọn phần lườn để món ăn được ngon hơn nhé). 1 củ hành tây. 1 lạng giá đỗ. Rau răm, rau mùi, rau thơm. 1 củ cà rốt. Lá chanh: 3 cái. 50 gam lạc, 50 gam vừng. Giấm, tỏi, chanh, ớt. Sốt chua ngọt. Các loại gia vị cần dùng cho món ăn: đường, nước mắm, muối tinh|1 cái hoa chuối. 1,5 lạng thịt gà (nên chọn phần lườn để món ăn được ngon hơn nhé). 1 củ hành tây. 1 lạng giá đỗ. Rau răm, rau mùi, rau thơm. 1 củ cà rốt. Lá chanh: 3 cái. 50 gam lạc, 50 gam vừng. Giấm, tỏi, chanh, ớt. Sốt chua ngọt. Các loại gia vị cần dùng cho món ăn: đường, nước mắm, muối tinh|1 cái hoa chuối. 1,5 lạng thịt gà (nên chọn phần lườn để món ăn được ngon hơn nhé). 1 củ hành tây. 1 lạng giá đỗ. Rau răm, rau mùi, rau thơm. 1 củ cà rốt. Lá chanh: 3 cái. 50 gam lạc, 50 gam vừng. Giấm, tỏi, chanh, ớt. Sốt chua ngọt. Các loại gia vị cần dùng cho món ăn: đường, nước mắm, muối tinh|1 cái hoa chuối. 1,5 lạng thịt gà (nên chọn phần lườn để món ăn được ngon hơn nhé). 1 củ hành tây. 1 lạng giá đỗ. Rau răm, rau mùi, rau thơm. 1 củ cà rốt. Lá chanh: 3 cái. 50 gam lạc, 50 gam vừng. Giấm, tỏi, chanh, ớt. Sốt chua ngọt. Các loại gia vị cần dùng cho món ăn: đường, nước mắm, muối tinh|","Hoa chuối lột bỏ phần vỏ già bên ngoài rồi dùng dao sắc thái thật mỏng ra. Tiếp đó ta đem phần hoa chuối này ngâm vào chậu nước muối pha loãng cùng vài giọt nước cốt chanh để hoa chuối không bị thâm đen, luôn giữ được màu sắc đẹp nhất nhé. Ta ngâm trong khoảng 10 phút rồi vớt ra rổ cho ráo nước.; Tỏi lột vỏ ngoài rồi đập dập, băm nhỏ.; Thực hiện pha nước mắm trộn nộm như sau: cho vào một bát con 1 thìa nước cốt chanh, 1 thìa dấm gạo, 1 thìa đường, 1 nửa thìa nước mắm, 1 ít tỏi băm, ớt thái nhỏ, chút muối rồi dùng đũa khuấy tan đều lên cho ngấm gia vị.; Cho hoa chuối, thịt gà xé, hành tây, cà rốt vào một âu to rồi đổ phần nước trộn nộm vừa pha vào, sử dụng găng tay ni lông trộn đều và thật nhẹ nhàng lên cho ngấm. Chắt hết phần nước ra.; Cho rau thơm thái nhỏ cùng lá chanh thái chỉ vào âu rồi tiếp tục trộn đều lên. Thêm vào 1 thìa sốt chua ngọt, vừng lạc đã rang vào và trộn đều lên vài lượt.; Trình bày món ăn ra đĩa to rồi trang trí tùy ý thích sao cho đẹp mắt và thưởng thức luôn nộm hoa chuối thịt gà nhé.|Hoa chuối lột bỏ phần vỏ già bên ngoài rồi dùng dao sắc thái thật mỏng ra. Tiếp đó ta đem phần hoa chuối này ngâm vào chậu nước muối pha loãng cùng vài giọt nước cốt chanh để hoa chuối không bị thâm đen, luôn giữ được màu sắc đẹp nhất nhé. Ta ngâm trong khoảng 10 phút rồi vớt ra rổ cho ráo nước.; Tỏi lột vỏ ngoài rồi đập dập, băm nhỏ.; Thực hiện pha nước mắm trộn nộm như sau: cho vào một bát con 1 thìa nước cốt chanh, 1 thìa dấm gạo, 1 thìa đường, 1 nửa thìa nước mắm, 1 ít tỏi băm, ớt thái nhỏ, chút muối rồi dùng đũa khuấy tan đều lên cho ngấm gia vị.; Cho hoa chuối, thịt gà xé, hành tây, cà rốt vào một âu to rồi đổ phần nước trộn nộm vừa pha vào, sử dụng găng tay ni lông trộn đều và thật nhẹ nhàng lên cho ngấm. Chắt hết phần nước ra.; Cho rau thơm thái nhỏ cùng lá chanh thái chỉ vào âu rồi tiếp tục trộn đều lên. Thêm vào 1 thìa sốt chua ngọt, vừng lạc đã rang vào và trộn đều lên vài lượt.; Trình bày món ăn ra đĩa to rồi trang trí tùy ý thích sao cho đẹp mắt và thưởng thức luôn nộm hoa chuối thịt gà nhé.|Hoa chuối lột bỏ phần vỏ già bên ngoài rồi dùng dao sắc thái thật mỏng ra. Tiếp đó ta đem phần hoa chuối này ngâm vào chậu nước muối pha loãng cùng vài giọt nước cốt chanh để hoa chuối không bị thâm đen, luôn giữ được màu sắc đẹp nhất nhé. Ta ngâm trong khoảng 10 phút rồi vớt ra rổ cho ráo nước.; Tỏi lột vỏ ngoài rồi đập dập, băm nhỏ.; Thực hiện pha nước mắm trộn nộm như sau: cho vào một bát con 1 thìa nước cốt chanh, 1 thìa dấm gạo, 1 thìa đường, 1 nửa thìa nước mắm, 1 ít tỏi băm, ớt thái nhỏ, chút muối rồi dùng đũa khuấy tan đều lên cho ngấm gia vị.; Cho hoa chuối, thịt gà xé, hành tây, cà rốt vào một âu to rồi đổ phần nước trộn nộm vừa pha vào, sử dụng găng tay ni lông trộn đều và thật nhẹ nhàng lên cho ngấm. Chắt hết phần nước ra.; Cho rau thơm thái nhỏ cùng lá chanh thái chỉ vào âu rồi tiếp tục trộn đều lên. Thêm vào 1 thìa sốt chua ngọt, vừng lạc đã rang vào và trộn đều lên vài lượt.; Trình bày món ăn ra đĩa to rồi trang trí tùy ý thích sao cho đẹp mắt và thưởng thức luôn nộm hoa chuối thịt gà nhé.|Hoa chuối lột bỏ phần vỏ già bên ngoài rồi dùng dao sắc thái thật mỏng ra. Tiếp đó ta đem phần hoa chuối này ngâm vào chậu nước muối pha loãng cùng vài giọt nước cốt chanh để hoa chuối không bị thâm đen, luôn giữ được màu sắc đẹp nhất nhé. Ta ngâm trong khoảng 10 phút rồi vớt ra rổ cho ráo nước.; Tỏi lột vỏ ngoài rồi đập dập, băm nhỏ.; Thực hiện pha nước mắm trộn nộm như sau: cho vào một bát con 1 thìa nước cốt chanh, 1 thìa dấm gạo, 1 thìa đường, 1 nửa thìa nước mắm, 1 ít tỏi băm, ớt thái nhỏ, chút muối rồi dùng đũa khuấy tan đều lên cho ngấm gia vị.; Cho hoa chuối, thịt gà xé, hành tây, cà rốt vào một âu to rồi đổ phần nước trộn nộm vừa pha vào, sử dụng găng tay ni lông trộn đều và thật nhẹ nhàng lên cho ngấm. Chắt hết phần nước ra.; Cho rau thơm thái nhỏ cùng lá chanh thái chỉ vào âu rồi tiếp tục trộn đều lên. Thêm vào 1 thìa sốt chua ngọt, vừng lạc đã rang vào và trộn đều lên vài lượt.; Trình bày món ăn ra đĩa to rồi trang trí tùy ý thích sao cho đẹp mắt và thưởng thức luôn nộm hoa chuối thịt gà nhé.|",http://elinerfood.com/wp-content/uploads/2016/05/mam-com-56-365-mam-com-gia-dinh.jpg,3.83
94,5cbf3d1ca29e122e4c79a9a3,"mực xào dứa,cá thu sốt cà chua,đỗ luộc,canh đậu hũ cà chua","1 cái hoa chuối. 1,5 lạng thịt gà (nên chọn phần lườn để món ăn được ngon hơn nhé). 1 củ hành tây. 1 lạng giá đỗ. Rau răm, rau mùi, rau thơm. 1 củ cà rốt. Lá chanh: 3 cái. 50 gam lạc, 50 gam vừng. Giấm, tỏi, chanh, ớt. Sốt chua ngọt. Các loại gia vị cần dùng cho món ăn: đường, nước mắm, muối tinh|1 cái hoa chuối. 1,5 lạng thịt gà (nên chọn phần lườn để món ăn được ngon hơn nhé). 1 củ hành tây. 1 lạng giá đỗ. Rau răm, rau mùi, rau thơm. 1 củ cà rốt. Lá chanh: 3 cái. 50 gam lạc, 50 gam vừng. Giấm, tỏi, chanh, ớt. Sốt chua ngọt. Các loại gia vị cần dùng cho món ăn: đường, nước mắm, muối tinh|1 cái hoa chuối. 1,5 lạng thịt gà (nên chọn phần lườn để món ăn được ngon hơn nhé). 1 củ hành tây. 1 lạng giá đỗ. Rau răm, rau mùi, rau thơm. 1 củ cà rốt. Lá chanh: 3 cái. 50 gam lạc, 50 gam vừng. Giấm, tỏi, chanh, ớt. Sốt chua ngọt. Các loại gia vị cần dùng cho món ăn: đường, nước mắm, muối tinh|1 cái hoa chuối. 1,5 lạng thịt gà (nên chọn phần lườn để món ăn được ngon hơn nhé). 1 củ hành tây. 1 lạng giá đỗ. Rau răm, rau mùi, rau thơm. 1 củ cà rốt. Lá chanh: 3 cái. 50 gam lạc, 50 gam vừng. Giấm, tỏi, chanh, ớt. Sốt chua ngọt. Các loại gia vị cần dùng cho món ăn: đường, nước mắm, muối tinh|","Hoa chuối lột bỏ phần vỏ già bên ngoài rồi dùng dao sắc thái thật mỏng ra. Tiếp đó ta đem phần hoa chuối này ngâm vào chậu nước muối pha loãng cùng vài giọt nước cốt chanh để hoa chuối không bị thâm đen, luôn giữ được màu sắc đẹp nhất nhé. Ta ngâm trong khoảng 10 phút rồi vớt ra rổ cho ráo nước.; Tỏi lột vỏ ngoài rồi đập dập, băm nhỏ.; Thực hiện pha nước mắm trộn nộm như sau: cho vào một bát con 1 thìa nước cốt chanh, 1 thìa dấm gạo, 1 thìa đường, 1 nửa thìa nước mắm, 1 ít tỏi băm, ớt thái nhỏ, chút muối rồi dùng đũa khuấy tan đều lên cho ngấm gia vị.; Cho hoa chuối, thịt gà xé, hành tây, cà rốt vào một âu to rồi đổ phần nước trộn nộm vừa pha vào, sử dụng găng tay ni lông trộn đều và thật nhẹ nhàng lên cho ngấm. Chắt hết phần nước ra.; Cho rau thơm thái nhỏ cùng lá chanh thái chỉ vào âu rồi tiếp tục trộn đều lên. Thêm vào 1 thìa sốt chua ngọt, vừng lạc đã rang vào và trộn đều lên vài lượt.; Trình bày món ăn ra đĩa to rồi trang trí tùy ý thích sao cho đẹp mắt và thưởng thức luôn nộm hoa chuối thịt gà nhé.|Hoa chuối lột bỏ phần vỏ già bên ngoài rồi dùng dao sắc thái thật mỏng ra. Tiếp đó ta đem phần hoa chuối này ngâm vào chậu nước muối pha loãng cùng vài giọt nước cốt chanh để hoa chuối không bị thâm đen, luôn giữ được màu sắc đẹp nhất nhé. Ta ngâm trong khoảng 10 phút rồi vớt ra rổ cho ráo nước.; Tỏi lột vỏ ngoài rồi đập dập, băm nhỏ.; Thực hiện pha nước mắm trộn nộm như sau: cho vào một bát con 1 thìa nước cốt chanh, 1 thìa dấm gạo, 1 thìa đường, 1 nửa thìa nước mắm, 1 ít tỏi băm, ớt thái nhỏ, chút muối rồi dùng đũa khuấy tan đều lên cho ngấm gia vị.; Cho hoa chuối, thịt gà xé, hành tây, cà rốt vào một âu to rồi đổ phần nước trộn nộm vừa pha vào, sử dụng găng tay ni lông trộn đều và thật nhẹ nhàng lên cho ngấm. Chắt hết phần nước ra.; Cho rau thơm thái nhỏ cùng lá chanh thái chỉ vào âu rồi tiếp tục trộn đều lên. Thêm vào 1 thìa sốt chua ngọt, vừng lạc đã rang vào và trộn đều lên vài lượt.; Trình bày món ăn ra đĩa to rồi trang trí tùy ý thích sao cho đẹp mắt và thưởng thức luôn nộm hoa chuối thịt gà nhé.|Hoa chuối lột bỏ phần vỏ già bên ngoài rồi dùng dao sắc thái thật mỏng ra. Tiếp đó ta đem phần hoa chuối này ngâm vào chậu nước muối pha loãng cùng vài giọt nước cốt chanh để hoa chuối không bị thâm đen, luôn giữ được màu sắc đẹp nhất nhé. Ta ngâm trong khoảng 10 phút rồi vớt ra rổ cho ráo nước.; Tỏi lột vỏ ngoài rồi đập dập, băm nhỏ.; Thực hiện pha nước mắm trộn nộm như sau: cho vào một bát con 1 thìa nước cốt chanh, 1 thìa dấm gạo, 1 thìa đường, 1 nửa thìa nước mắm, 1 ít tỏi băm, ớt thái nhỏ, chút muối rồi dùng đũa khuấy tan đều lên cho ngấm gia vị.; Cho hoa chuối, thịt gà xé, hành tây, cà rốt vào một âu to rồi đổ phần nước trộn nộm vừa pha vào, sử dụng găng tay ni lông trộn đều và thật nhẹ nhàng lên cho ngấm. Chắt hết phần nước ra.; Cho rau thơm thái nhỏ cùng lá chanh thái chỉ vào âu rồi tiếp tục trộn đều lên. Thêm vào 1 thìa sốt chua ngọt, vừng lạc đã rang vào và trộn đều lên vài lượt.; Trình bày món ăn ra đĩa to rồi trang trí tùy ý thích sao cho đẹp mắt và thưởng thức luôn nộm hoa chuối thịt gà nhé.|Hoa chuối lột bỏ phần vỏ già bên ngoài rồi dùng dao sắc thái thật mỏng ra. Tiếp đó ta đem phần hoa chuối này ngâm vào chậu nước muối pha loãng cùng vài giọt nước cốt chanh để hoa chuối không bị thâm đen, luôn giữ được màu sắc đẹp nhất nhé. Ta ngâm trong khoảng 10 phút rồi vớt ra rổ cho ráo nước.; Tỏi lột vỏ ngoài rồi đập dập, băm nhỏ.; Thực hiện pha nước mắm trộn nộm như sau: cho vào một bát con 1 thìa nước cốt chanh, 1 thìa dấm gạo, 1 thìa đường, 1 nửa thìa nước mắm, 1 ít tỏi băm, ớt thái nhỏ, chút muối rồi dùng đũa khuấy tan đều lên cho ngấm gia vị.; Cho hoa chuối, thịt gà xé, hành tây, cà rốt vào một âu to rồi đổ phần nước trộn nộm vừa pha vào, sử dụng găng tay ni lông trộn đều và thật nhẹ nhàng lên cho ngấm. Chắt hết phần nước ra.; Cho rau thơm thái nhỏ cùng lá chanh thái chỉ vào âu rồi tiếp tục trộn đều lên. Thêm vào 1 thìa sốt chua ngọt, vừng lạc đã rang vào và trộn đều lên vài lượt.; Trình bày món ăn ra đĩa to rồi trang trí tùy ý thích sao cho đẹp mắt và thưởng thức luôn nộm hoa chuối thịt gà nhé.|",http://elinerfood.com/wp-content/uploads/2016/05/mam-com-55-365-mam-com-gia-dinh.jpg,2.67
95,5cbf3d5ca29e122e4c79a9ca,"cá om dưa,lòng luộc,rau sống,canh cải nấu thịt băm","1 con cá diêu hồng lớn. 300g cải chua. 2 quả cà chua. 1/2 củ hành tây. Hành lá, tỏi. Các loại gia vị cơ bản||||","Cá mua về sơ chế như sau: bỏ vây, bỏ mang, bỏ vảy. Vì loài cá này có mùi tanh của bùn nên bạn hãy rửa qua với nước có pha chút muối và gừng để tẩy mùi, giúp cá thêm săn chắc, ngon hơn.; Dưa cải chua thái nhỏ, bóp đỡ phần nước để khi chế biến không bị tiết ra quá nhiều nước làm giảm độ ngon của món ăn.; Cà chua và hành tây rửa sạch rồi xắt múi cau.; Cho cá diêu hồng đã được chiên vàng vào, đậy nắp vung để om trong khoảng 15 phút, đến khi gần cạn nước trong chảo.; Rắc chút hành lá cùng hành tây vào, om thêm 2 phút nữa rồi tắt bếp và trình bày món cá diêu hồng om dưa ra đĩa.||||",http://elinerfood.com/wp-content/uploads/2016/06/mam-com-95-365-mam-com-gia-dinh.jpg,3.41
96,5cbf3d1ca29e122e4c79a9a1,"chả cá rán,đậu tẩm hành,rau muống xào tỏi,canh rau chua","1 cái hoa chuối. 1,5 lạng thịt gà (nên chọn phần lườn để món ăn được ngon hơn nhé). 1 củ hành tây. 1 lạng giá đỗ. Rau răm, rau mùi, rau thơm. 1 củ cà rốt. Lá chanh: 3 cái. 50 gam lạc, 50 gam vừng. Giấm, tỏi, chanh, ớt. Sốt chua ngọt. Các loại gia vị cần dùng cho món ăn: đường, nước mắm, muối tinh|1 cái hoa chuối. 1,5 lạng thịt gà (nên chọn phần lườn để món ăn được ngon hơn nhé). 1 củ hành tây. 1 lạng giá đỗ. Rau răm, rau mùi, rau thơm. 1 củ cà rốt. Lá chanh: 3 cái. 50 gam lạc, 50 gam vừng. Giấm, tỏi, chanh, ớt. Sốt chua ngọt. Các loại gia vị cần dùng cho món ăn: đường, nước mắm, muối tinh|1 cái hoa chuối. 1,5 lạng thịt gà (nên chọn phần lườn để món ăn được ngon hơn nhé). 1 củ hành tây. 1 lạng giá đỗ. Rau răm, rau mùi, rau thơm. 1 củ cà rốt. Lá chanh: 3 cái. 50 gam lạc, 50 gam vừng. Giấm, tỏi, chanh, ớt. Sốt chua ngọt. Các loại gia vị cần dùng cho món ăn: đường, nước mắm, muối tinh|1 cái hoa chuối. 1,5 lạng thịt gà (nên chọn phần lườn để món ăn được ngon hơn nhé). 1 củ hành tây. 1 lạng giá đỗ. Rau răm, rau mùi, rau thơm. 1 củ cà rốt. Lá chanh: 3 cái. 50 gam lạc, 50 gam vừng. Giấm, tỏi, chanh, ớt. Sốt chua ngọt. Các loại gia vị cần dùng cho món ăn: đường, nước mắm, muối tinh|","Hoa chuối lột bỏ phần vỏ già bên ngoài rồi dùng dao sắc thái thật mỏng ra. Tiếp đó ta đem phần hoa chuối này ngâm vào chậu nước muối pha loãng cùng vài giọt nước cốt chanh để hoa chuối không bị thâm đen, luôn giữ được màu sắc đẹp nhất nhé. Ta ngâm trong khoảng 10 phút rồi vớt ra rổ cho ráo nước.; Tỏi lột vỏ ngoài rồi đập dập, băm nhỏ.; Thực hiện pha nước mắm trộn nộm như sau: cho vào một bát con 1 thìa nước cốt chanh, 1 thìa dấm gạo, 1 thìa đường, 1 nửa thìa nước mắm, 1 ít tỏi băm, ớt thái nhỏ, chút muối rồi dùng đũa khuấy tan đều lên cho ngấm gia vị.; Cho hoa chuối, thịt gà xé, hành tây, cà rốt vào một âu to rồi đổ phần nước trộn nộm vừa pha vào, sử dụng găng tay ni lông trộn đều và thật nhẹ nhàng lên cho ngấm. Chắt hết phần nước ra.; Cho rau thơm thái nhỏ cùng lá chanh thái chỉ vào âu rồi tiếp tục trộn đều lên. Thêm vào 1 thìa sốt chua ngọt, vừng lạc đã rang vào và trộn đều lên vài lượt.; Trình bày món ăn ra đĩa to rồi trang trí tùy ý thích sao cho đẹp mắt và thưởng thức luôn nộm hoa chuối thịt gà nhé.|Hoa chuối lột bỏ phần vỏ già bên ngoài rồi dùng dao sắc thái thật mỏng ra. Tiếp đó ta đem phần hoa chuối này ngâm vào chậu nước muối pha loãng cùng vài giọt nước cốt chanh để hoa chuối không bị thâm đen, luôn giữ được màu sắc đẹp nhất nhé. Ta ngâm trong khoảng 10 phút rồi vớt ra rổ cho ráo nước.; Tỏi lột vỏ ngoài rồi đập dập, băm nhỏ.; Thực hiện pha nước mắm trộn nộm như sau: cho vào một bát con 1 thìa nước cốt chanh, 1 thìa dấm gạo, 1 thìa đường, 1 nửa thìa nước mắm, 1 ít tỏi băm, ớt thái nhỏ, chút muối rồi dùng đũa khuấy tan đều lên cho ngấm gia vị.; Cho hoa chuối, thịt gà xé, hành tây, cà rốt vào một âu to rồi đổ phần nước trộn nộm vừa pha vào, sử dụng găng tay ni lông trộn đều và thật nhẹ nhàng lên cho ngấm. Chắt hết phần nước ra.; Cho rau thơm thái nhỏ cùng lá chanh thái chỉ vào âu rồi tiếp tục trộn đều lên. Thêm vào 1 thìa sốt chua ngọt, vừng lạc đã rang vào và trộn đều lên vài lượt.; Trình bày món ăn ra đĩa to rồi trang trí tùy ý thích sao cho đẹp mắt và thưởng thức luôn nộm hoa chuối thịt gà nhé.|Hoa chuối lột bỏ phần vỏ già bên ngoài rồi dùng dao sắc thái thật mỏng ra. Tiếp đó ta đem phần hoa chuối này ngâm vào chậu nước muối pha loãng cùng vài giọt nước cốt chanh để hoa chuối không bị thâm đen, luôn giữ được màu sắc đẹp nhất nhé. Ta ngâm trong khoảng 10 phút rồi vớt ra rổ cho ráo nước.; Tỏi lột vỏ ngoài rồi đập dập, băm nhỏ.; Thực hiện pha nước mắm trộn nộm như sau: cho vào một bát con 1 thìa nước cốt chanh, 1 thìa dấm gạo, 1 thìa đường, 1 nửa thìa nước mắm, 1 ít tỏi băm, ớt thái nhỏ, chút muối rồi dùng đũa khuấy tan đều lên cho ngấm gia vị.; Cho hoa chuối, thịt gà xé, hành tây, cà rốt vào một âu to rồi đổ phần nước trộn nộm vừa pha vào, sử dụng găng tay ni lông trộn đều và thật nhẹ nhàng lên cho ngấm. Chắt hết phần nước ra.; Cho rau thơm thái nhỏ cùng lá chanh thái chỉ vào âu rồi tiếp tục trộn đều lên. Thêm vào 1 thìa sốt chua ngọt, vừng lạc đã rang vào và trộn đều lên vài lượt.; Trình bày món ăn ra đĩa to rồi trang trí tùy ý thích sao cho đẹp mắt và thưởng thức luôn nộm hoa chuối thịt gà nhé.|Hoa chuối lột bỏ phần vỏ già bên ngoài rồi dùng dao sắc thái thật mỏng ra. Tiếp đó ta đem phần hoa chuối này ngâm vào chậu nước muối pha loãng cùng vài giọt nước cốt chanh để hoa chuối không bị thâm đen, luôn giữ được màu sắc đẹp nhất nhé. Ta ngâm trong khoảng 10 phút rồi vớt ra rổ cho ráo nước.; Tỏi lột vỏ ngoài rồi đập dập, băm nhỏ.; Thực hiện pha nước mắm trộn nộm như sau: cho vào một bát con 1 thìa nước cốt chanh, 1 thìa dấm gạo, 1 thìa đường, 1 nửa thìa nước mắm, 1 ít tỏi băm, ớt thái nhỏ, chút muối rồi dùng đũa khuấy tan đều lên cho ngấm gia vị.; Cho hoa chuối, thịt gà xé, hành tây, cà rốt vào một âu to rồi đổ phần nước trộn nộm vừa pha vào, sử dụng găng tay ni lông trộn đều và thật nhẹ nhàng lên cho ngấm. Chắt hết phần nước ra.; Cho rau thơm thái nhỏ cùng lá chanh thái chỉ vào âu rồi tiếp tục trộn đều lên. Thêm vào 1 thìa sốt chua ngọt, vừng lạc đã rang vào và trộn đều lên vài lượt.; Trình bày món ăn ra đĩa to rồi trang trí tùy ý thích sao cho đẹp mắt và thưởng thức luôn nộm hoa chuối thịt gà nhé.|",http://elinerfood.com/wp-content/uploads/2016/05/mam-com-53-365-mam-com-gia-dinh.jpg,3.88
97,5cbf3d54a29e122e4c79a9c7,"cá chạch rán giòn,chả lá lốt,đậu phụ sống,canh bí đỏ",||||,||||,http://elinerfood.com/wp-content/uploads/2016/06/mam-com-92-365-mam-com-gia-dinh.jpg,3.26
98,5cbf3d5ca29e122e4c79a9cf,"nộm gà xé phay,cá rô chiên giòn,canh rau cải ngọt,dưa muối",||||,||||,http://elinerfood.com/wp-content/uploads/2016/06/mam-com-100-365-mam-com-gia-dinh.jpg,3.79
