meal_id,actual_id,recipes,ingredients,methods,image,average_rating
191,5d727357422d438f3fea954c,"thịt đông,bò  xào cà ri,canh cá chép đậu đỏ,sơ ri ướp lạnh",||||,||||,,3.59
192,5d727356422d438f3fea953d,"tôm chua riềng,bông bí xào ức gà,canh bí đỏ nấu sườn,nước ép dưa hấu",||||,||||,,3.44
193,5d727357422d438f3fea9543,"thịt nạc kho tiêu,giá hẹ xào tim heo,canh bầu nấu tôm,nước ép ổi",||||,||||,,3.9
194,5d727352422d438f3fea9520,"súp bó xôi thịt cua,sữa đậu nành",||,||,,4.22
195,5d727354422d438f3fea9522,"cá chạch kho lá nghệ,canh cải xooang cá thác lác,đậu hũ chiên xù,lê ướp lạnh",||||,||||,,3.0
196,5d727354422d438f3fea9525,"cá chẻm chiên xù,bò xào bông cải,khổ qua dồn thịt,sinh tố dâu",||||,||||,,3.0
197,5d727355422d438f3fea9535,"cơm chiên dương châu,nước củ sen",||,||,,3.43
198,5d727359422d438f3fea955d,"điêu  hồng kho tương,mướp xào lòng heo,hoa chuối cá kèo,rau  câu dừa",||||,||||,,4.49
199,5d727357422d438f3fea9545,"cá lóc nướng trui,canh bí đỏ nấu tôm khô,trứng chiên thịt,mận",||||,||||,,3.57
200,5d727358422d438f3fea9556,"cháo thịt  thỏ,nước ép vải",||,||,,4.08
201,5d727359422d438f3fea9559,"bún đậu phụ  mắm tôm,sinh tố chuối và dứa",||,||,,3.0
202,5d727354422d438f3fea9524,"gan heo hầm hà thủ ô,cải mầm trộn dầu giấm,canh chua tôm ngó sen,nước ép cà rốt",||||,||||,,3.0
203,5d727355422d438f3fea952c,"bánh canh ghẹ,nước rau má",||,||,,3.81
204,5d727355422d438f3fea9530,"cá trê chiên giòn,giá xào hẹ,canh ngót nấu bò,bánh flan",||||,||||,,3.0
205,5d727355422d438f3fea9532,"bún mọc,sữa đậu phộng",||,||,,3.43
206,5d727356422d438f3fea953b,"miến gà,chuối cau",||,||,,4.24
207,5d727359422d438f3fea955a,"ngan kho gừng,cải thìa  xào dầu hào,ngót nấu cá khoai,sinh tố đu đủ",||||,||||,,4.0
208,5d727359422d438f3fea955f,"bún gạo xào hải sản,nước ép táo",||,||,,3.0
209,5d727355422d438f3fea952e,"bắp bò ngâm nước mắm,rau muống xào tỏi,canh hến nấu khế,nước ép củ dền",||||,||||,,4.78
210,5d727358422d438f3fea954f,"cá thu chiên  xốt chanh dây,tôm xào hạnh nhân,cải xooang nấu bò,sinh  tố sa-bô-chê",||||,||||,,3.63
211,5d727358422d438f3fea9551,"cá  lóc kho tộ,cà chua dồn cốm chiên,móng heo hầm hạt sen,chè  hạt sen",||||,||||,,3.31
212,5d727358422d438f3fea9554,"ếch chiên bơ,măng  xào lá lốt,canh đu đủ nấu giò heo,mận ướp lạnh",||||,||||,,4.92
213,5d727359422d438f3fea955e,"tôm kho rim,cải dún xào gan,rau  đắng đất nấu cá lóc,sinh tố cà chua",||||,||||,,3.0
214,5d727357422d438f3fea9544,"sanwich kẹp jambon xông khói,sữa cacao",||,||,,3.33
215,5d727359422d438f3fea9557,"thịt bò xào cà ri,đậu rồng xào,hến  nấu thì là,hạt điều gương",||||,||||,,3.76
216,5d727354422d438f3fea9521,"cá cơm chiên bột,đậu bắp xào nấm rơm,canh tần ô thịt bò,dưa hấu",||||,||||,,3.0
217,5d727354422d438f3fea9523,"bánh mì ốp la,sữa tươi",||,||,,3.3
218,5d727354422d438f3fea9528,"thịt kho củ cải,cải thìa luộc,canh khoai mỡ nấu thịt bằm,trà gừng",||||,||||,,4.0
219,5d727354422d438f3fea9529,"bánh hỏi thịt nướng,sữa đậu nành",||,||,,3.0
220,5d727355422d438f3fea952d,"sườn chiên xả ớt,cải thìa xào tôm,canh củ dền nấu tôm tươi,đậu phộng da cá",||||,||||,,3.0
221,5d727356422d438f3fea9536,"sườn heo sốt bbq,ngồng cải chấm nước mắm trứng,canh cải cúc thịt bằm,nước ép táo xanh",||||,||||,,4.01
222,5d727358422d438f3fea9552,"cá bống kho tiêu,rau cải xanh luộc,canh  củ cải nấu bò,mãng cầu giằm sữa",||||,||||,,4.26
223,5d72735e422d438f3fea958f,"mì gói nấu hải sản,nước  sấu ngâm",||,||,,3.76
224,5d72735f422d438f3fea959a,"tôm hấp nước dừa,cà ri mực,kem sầu riêng",|||,|||,,4.23
225,5d72735f422d438f3fea959e,"cháo đậu đỏ,sữa đậu  nành",||,||,,4.51
226,5d72735c422d438f3fea957c,"canh rau muống nấu hến,mực trứng kho tộ,hải sản xào rau củ,nước ép thơm",||||,||||,,4.43
227,5d72735c422d438f3fea9579,"canh astiso nấu hải sản,cá sốt chanh dây,tôm xào hạnh nhân,chè đậu xanh",||||,||||,,3.79
228,5d72735f422d438f3fea959d,"súp măng sò điệp,bún mắm,sinh tố kiwi",|||,|||,,3.75
229,5d72735a422d438f3fea9565,"hamburger bò,nước ép bưởi",||,||,,4.26
230,5d72735d422d438f3fea9586,"miến xào cua,nước mơ ngâm",||,||,,3.36
231,5d72735f422d438f3fea9598,"xôi mặn,nước chanh muối",||,||,,3.66
232,5d72735c422d438f3fea957b,"canh mướp nấu nấm rơm,bò rim ngũ vị,dưa khổ qua đèo,chè bắp",||||,||||,,4.0
233,5d72735e422d438f3fea9593,"canh cải thảo nấu thịt băm,bê xào lá nghệ,cà tím chiên giòn,dưa hấu ướp lạnh",||||,||||,,4.23
234,5d72735f422d438f3fea959b,"bánh bèo,nước trà gừng",||,||,,4.13
235,5d72735f422d438f3fea95a0,"cá chạch kho lá nghệ,canh cải xoong cá thác lác,đậu  hũ chiên xù,lê ướp lạnh",||||,||||,,3.96
236,5d727360422d438f3fea95a4,"nui xào hải sản,nước  ép ổi",||,||,,4.16
237,5d72735b422d438f3fea956c,"cá rô kho rau răm,nấm bào ngư xào thịt heo,canh khổ hoa dồn thịt lợn,chè mủ trôm",||||,||||,,3.33
238,5d72735e422d438f3fea9591,"xà lách trộn thịt bò,thịt lẩu xào hành tây ngâm chua,đậu que xào tỏi,sinh tố sa-bô-chê",||||,||||,,4.55
239,5d72735e422d438f3fea9595,"bánh bao,sữa tươi",||,||,,3.5
240,5d72735b422d438f3fea956e,"súp tương miso trứng nấm,sinh tố cà chua",||,||,,4.02
241,5d72735c422d438f3fea9574,"bánh đa cua,trà chanh",||,||,,4.49
242,5d72735c422d438f3fea957a,"bún thang,nước mía",||,||,,4.3
243,5d72735d422d438f3fea9582,"canh giò heo nấu măng,thịt nạc kho tiêu,đọt bí xào tỏi,trái cây ướp lạnh",||||,||||,,4.81
244,5d727360422d438f3fea95aa,"bột chiên,nước rau  má",||,||,,4.21
245,5d72735d422d438f3fea9583,"bún bung,sinh tố bơ",||,||,,4.95
246,5d72735d422d438f3fea9589,"bún cá,nước cam",||,||,,3.72
247,5d72735e422d438f3fea9596,"canh bí đỏ hầm giò heo,đùi gà om sả tế,rau mồng tơi xào tỏi,chè táo xọn",||||,||||,,4.71
248,5d72735b422d438f3fea956d,"cá trê kho tương,rau bí xào tỏi,canh gà nấu lá giang,mứt thơm",||||,||||,,4.71
249,5d72735a422d438f3fea9566,"đùi gà chiên tỏi ớt,dưa món,canh cá điêu hồng chua ngọt,sấu ngăm đường giằm đá",||||,||||,,4.69
250,5d72735d422d438f3fea9580,"cơm tấm,nước rau má đậu xanh",||,||,,4.9
251,5d72735e422d438f3fea958d,"canh cá lóc nấu cần,thơm may mắn,cải chua xào trứng,chè thái",||||,||||,,4.54
252,5d72735b422d438f3fea9569,"ba rọi chiên nước mắm,xà lách trộn dầu giấm,bí đỏ nấu sườn heo,chuối cau",||||,||||,,3.44
253,5d72735c422d438f3fea9578,"canh tôm nõn nấu bí đao,tôm rang trứng muối,salad rau mầm,mít ướp lạnh",||||,||||,,3.96
254,5d72735d422d438f3fea9588,"salad trái cây,mì xào dòn,bánh flan",|||,|||,,4.2
255,5d72735d422d438f3fea958a,"canh gà nấu lá giang,sườn non kho cải chua,dọc mùng xào sả,chè nhãn nhục",||||,||||,,4.5
256,5d727360422d438f3fea95a6,"thịt kho củ cải,cải thìa luộc,canh khoai  mỡ nấu thịt bằm,trà gừng",||||,||||,,3.51
257,5d727359422d438f3fea9560,"cá trắm hấp cải xanh,bò xào cần nước,canh chuối già nấu mẻ,dưa hấu ướp lạnh",||||,||||,,4.43
258,5d72735b422d438f3fea956f,"sườn kho chua ngọt,đậu hủ chiên sả,rau đay nấu cua,sinh tố dưa hấu",||||,||||,,3.76
259,5d72735a422d438f3fea9568,"cơm chiên bí đỏ,nước ép dưa hấu",||,||,,4.0
260,5d72735c422d438f3fea9577,"miến gà,sữa đậu nành",||,||,,4.0
261,5d72735d422d438f3fea9581,"canh cá lóc nấu bầu,cá bống đục kho nước dừa,rau muống xào,chè khoai cao",||||,||||,,4.37
262,5d72735e422d438f3fea9594,"canh thịt bò rau răm,thịt ba rọi kho nấm đông cô,rau củ luộc nước mắm kho tiêu,chè bắp",||||,||||,,4.0
263,5d72735f422d438f3fea959c,"ốc luộc chấm nước mắm gừng,lẩu thái chua cay,xôi xiêm",|||,|||,,3.95
264,5d727360422d438f3fea95a7,"bánh chưng chiên sốt sa tế  me,sữa đậu nành",||,||,,3.51
265,5d72735d422d438f3fea9587,"súp cua bắp non,bún bò giò heo,chè hoa cúc táo đỏ",|||,|||,,3.7
266,5d72735e422d438f3fea958e,"canh cải rổ nấu tôm viên,sườn khìa nước dừa,hoa mướp xào tỏi,bánh gan",||||,||||,,3.06
267,5d727360422d438f3fea95a2,"cá lóc kho tộ,cải mầm trộn dầu giấm,cá  thu nhật nấu ngót,nước ép cà rốt",||||,||||,,3.44
268,5d727360422d438f3fea95a5,"há cảo chiên,khổ qua xào trứng,canh chua  cá hồi,nho",||||,||||,,3.22
269,5d72735a422d438f3fea9563,"ếch rim sả ớt,xà lách trộn dầu giấm,củ năng nấu sườn,sinh tố cà chua",||||,||||,,3.0
270,5d72735b422d438f3fea956a,"cá cơm kho tiêu,cải xào tỏi,khoai môn nấu giò,lê ướp lạnh",||||,||||,,3.0
271,5d72735b422d438f3fea956b,"bún gạo xào hải sản,cà phê sữa",||,||,,3.64
272,5d72735b422d438f3fea9570,"tép rang,bắp cải luộc,rau dền nấu thịt bò,nước ép cà rốt",||||,||||,,3.24
273,5d72735e422d438f3fea958c,"bún riêu,nước rau má bạc hà",||,||,,5.0
274,5d72735f422d438f3fea95a1,"bánh mì ốp la,sữa  tươi",||,||,,2.92
275,5d72735a422d438f3fea9564,"khoai tây nhồi thịt heo chiên,hoa thiên lý trộn bò,bí đao xào tôm thịt,sữa chua",||||,||||,,3.62
276,5d72735b422d438f3fea9572,"lẩu bò,sinh tố sa-bô-chê",||,||,,3.19
277,5d72735b422d438f3fea9573,"cá lóc kho tộ,cà tím nướng mỡ hành,đậu phụ hẹ nấu thịt bằm,nước ép táo",||||,||||,,3.48
278,5d72735c422d438f3fea957f,"canh tôm nõn cải dún,cánh gà chiên xốt tương java,xà lách cà chua,bánh khoai mì",||||,||||,,3.58
279,5d72735e422d438f3fea958b,"canh sa kê nấu thịt băm,vịt quay om nước tương,chả giò nghêu,dưa hấu ướp lạnh",||||,||||,,4.0
280,5d72735e422d438f3fea9592,"bún bò huế,nước dừa  tươi",||,||,,3.0
281,5d72735f422d438f3fea9599,"bò nướng kiệu,bún xào singapore,chè nếp than",|||,|||,,3.4
282,5d72735a422d438f3fea9567,"mực dồn thịt chiên,cải ngọt luộc,bí ngô nấu sườn,nước ép nho",||||,||||,,3.0
283,5d72735c422d438f3fea9575,"canh đậu ngự hầm xường non,thịt kho củ cải,bò xào nấmbắp non  cà rốt,chè hạt sen",||||,||||,,3.0
284,5d72735d422d438f3fea9584,"gỏi cóc trộn khô mực,bánh xèo ăn kèm rau sống,cơm rượu bắc",|||,|||,,3.0
285,5d72735e422d438f3fea9590,"canh chua khoai sọ nấu rau nhút,thịt kho măng,rau dền luộc,chè khoai môn",||||,||||,,5.0
286,5d72735e422d438f3fea9597,"canh nghêu chua ngọt,cá thu nhật chiên nước mắm,nem thịt,nho ướp lạnh",||||,||||,,2.91
287,5d727360422d438f3fea95a9,"cá lóc kho xốt tương gừng,cà tím nướng,canh  cá lóc nấu thơm,chè đậu đen",||||,||||,,2.62
288,5d72735a422d438f3fea9562,"spaghetti trộn trứng cá cay,sinh tố xoài",||,||,,4.0
289,5d72735b422d438f3fea9571,"phá lấu bánh mì,mãng cầu giằm sữa",||,||,,3.3
290,5d72735c422d438f3fea9576,"canh cá thu nấu ngót,cá kho dưa hường,tôm nõn xào rau củ,nước ép chanh dây",||||,||||,,3.51
291,5d72735c422d438f3fea957e,"canh chua cá lóc,cá thu kho gừng,mực xào thơm,sinh tố dâu",||||,||||,,4.0
292,5d72735d422d438f3fea9585,"hải sâm trộn cải thìa,lẩu tươi,kem dừa",|||,|||,,3.2
293,5d72735f422d438f3fea959f,"salad xúc xích,đậu bắp xào nấm rơm,canh  tần ô thịt bò,dưa hấu",||||,||||,,2.95
294,5d727360422d438f3fea95a8,"tôm rim,thiên lý xào thịt bò,canh củ  năng nấu sườn non,sinh tố dưa gang",||||,||||,,1.0
295,5d727359422d438f3fea9561,"gà hầm sả,rau muống luộc,canh khoai môn hầm giò,nho xanh",||||,||||,,3.45
296,5d72735c422d438f3fea957d,"cháo trứng thịt nạc,sữa đậu nành",||,||,,3.57
297,5d727360422d438f3fea95a3,"cá chẻm chiên xù,bò xào bông cải,khổ qua  dồn thịt,sinh tố dâu",||||,||||,,3.0
298,5d727361422d438f3fea95b5,"cá chim chiên tỏi,cải thìa xào nấm,thiên lý nấu bò,sinh tố sa-bô-chê",||||,||||,,3.61
299,5d727363422d438f3fea95ca,"cá điêu hồng chiên xù,rau lang luộc,canh  khoai mỡ nấu tôm tươi,chuối cau",||||,||||,,3.33
300,5d727363422d438f3fea95cc,"ếch rim xả ớt,cần ống xào bò,canh cải  xoong nấu bò,sinh tố cà chua",||||,||||,,4.0
301,5d727364422d438f3fea95d8,"cá trê chiên giòn chấm mắm gừng,rau cải xanh  luộc,canh củ cải nấu giò heo,chè môn",||||,||||,,3.16
302,5d727365422d438f3fea95e3,"cơm chiên hải sản,nước ép  thơm",||,||,,3.52
303,5d727360422d438f3fea95ad,"bún gạo xào,sữa  tươi",||,||,,4.0
304,5d727361422d438f3fea95b3,"patê gan gà, bánh mì,táo  ép",||,||,,4.0
305,5d727366422d438f3fea95e8,"thịt kho dưa cải,rau  muống xào,canh cá lóc nấu thơm,chè đậu xanh nước dừa",||||,||||,,3.16
306,5d727361422d438f3fea95b4,"thịt ba rọi chiên xả ớt,rau càng cua trộn thịt  bò,canh khổ qua cá,dưa hấu",||||,||||,,0.0
307,5d727362422d438f3fea95bf,"cháo vịt,nước ép  vải",||,||,,2.77
308,5d727362422d438f3fea95c6,"thịt ba chỉ luộc,cải chua xào chả cá,canh  hoa chuối cá kèo,rau câu trái cây",||||,||||,,3.73
309,5d727360422d438f3fea95ac,"bắp bò ngâm nước mắm,rau muống xào tỏi,canh  hến nấu khế,nước ép củ dền",||||,||||,,5.0
310,5d727362422d438f3fea95bd,"cá bống kho tiêu,gỏi su hào nấm tuyết,canh  đu đủ nấu giò heo,lê ướp lạnh",||||,||||,,3.76
311,5d727363422d438f3fea95c9,"gà cuộn lá chanh,bò xào bông hẹ,canh khổ  qua nấu thác lác,sinh tố bơ",||||,||||,,3.97
312,5d727363422d438f3fea95cf,"thịt heo kho tiêu,rau cải xanh luộc,canh  cải cúc nấu bò,rau câu dừa",||||,||||,,3.0
313,5d727363422d438f3fea95d0,"mực xào sa tế,mướp xào lòng gà,canh nấm  rơm đậu hũ non,chè hạnh nhân",||||,||||,,3.93
314,5d727365422d438f3fea95df,"cá kèo nướng muối,canh  rau muốn nấu me,đậu hũ chiên,lê ướp lạnh",||||,||||,,3.4
315,5d727361422d438f3fea95b7,"mực xào cà ri,mướp xào lòng gà,canh chua  cá lóc,táo xanh",||||,||||,,5.0
316,5d727362422d438f3fea95be,"tôm xào sa tế,rau muống xào tỏi,canh  chua hải sản,sữa chua",||||,||||,,2.66
317,5d727362422d438f3fea95bb,"bò xào bông cải,rau cải xanh luộc,canh  măng nấu tôm viên,mãng cầu giằm sữa",||||,||||,,3.4
318,5d727363422d438f3fea95ce,"bánh cuốn,bưởi ép  nho",||,||,,3.0
319,5d727365422d438f3fea95e1,"cá rô  kho tiêu,cải thìa xào tôm,canh chua cá lóc,nước  rau má",||||,||||,,3.38
320,5d727366422d438f3fea95e4,"bò  nướng tiêu,khổ qua xào trứng,canh cua rau đay,nho  tươi",||||,||||,,3.88
321,5d727364422d438f3fea95d6,"đùi gà chiên tỏi ớt,tôm xào đậu tương,gà  nấu lá giang,sâm bổ lượng",||||,||||,,5.0
322,5d727364422d438f3fea95db,"lẩu thái,sinh tố dừa",||,||,,3.23
323,5d727361422d438f3fea95b9,"hambuger bò,sữa đậu  xanh nóng",||,||,,3.4
324,5d727362422d438f3fea95c2,"súp cua,sôcô-la  nóng",||,||,,3.0
325,5d727363422d438f3fea95c8,"miến gà,cà phê sữa",||,||,,3.91
326,5d727365422d438f3fea95dc,"cá lóc kho tộ,cà tím nướng mỡ hành,canh  rau dền nấu thịt bò,chuối nướng",||||,||||,,4.07
327,5d727361422d438f3fea95b6,"bún thịt nướng,cà  phê sữa nóng",||,||,,3.25
328,5d727365422d438f3fea95e2,"đuôi  heo hầm kỷ tử và atiso,mực xào hành cần,khổ qua dồn  thịt,táo ướp lạnh",||||,||||,,3.01
329,5d727366422d438f3fea95e5,"thịt  kho trứng,gỏi hoa chuối khô bò,canh khoai mỡ nấu thịt  bằm,trà lài",||||,||||,,3.69
330,5d727362422d438f3fea95c5,"hủ tiếu xào hải sản,sữa  tươi",||,||,,3.0
331,5d727364422d438f3fea95da,"miến cua xào,nước  ép cà rốt",||,||,,2.95
332,5d727366422d438f3fea95e9,"nui xào bò,nước ép xoài",||,||,,3.72
333,5d727360422d438f3fea95ab,"sườn chiên xả ớt,cải thìa xào tôm thịt,canh  củ dền nấu tôm tươi,sinh tố chuối",||||,||||,,4.0
334,5d727361422d438f3fea95af,"thịt xông khói măng tây,bò xào tỏi tây,canh  súp khoai tây cà rốt,sinh tố cà chua",||||,||||,,3.88
335,5d727362422d438f3fea95bc,"bún bò,sinh tố cà  chua",||,||,,3.18
336,5d727362422d438f3fea95c0,"lẩu cua đồng bánh đa,chè đậu ngự",||,||,,3.0
337,5d727362422d438f3fea95c4,"lươn xào sả ớt,canh rau cải xanh nấu ruốc,rau  càng cua trộn,trứng giấm đường,trái cây ướp lạnh",||||,||||,,2.73
338,5d727363422d438f3fea95cd,"cá hấp trứng,cải bó xôi xào nấm đông cô,canh  thìa là cá điêu hồng,chè đậu đỏ",||||,||||,,3.74
339,5d727364422d438f3fea95d4,"bún gạo xào bò,bạc  xỉu",||,||,,3.0
340,5d727364422d438f3fea95d7,"cháo lá dứa hột vịt muối,sinh  tố mãng cầu",||,||,,3.12
341,5d727362422d438f3fea95c1,"thịt kho trứng,củ sen xào tôm,canh cải  cúc nấu thịt bò,sinh tố dưa hấu",||||,||||,,3.81
342,5d727364422d438f3fea95d1,"bánh mì trứng ốp la,sữa  đậu nành",||,||,,3.0
343,5d727364422d438f3fea95d2,"thịt ba rọi chiên nước mắm,bao tử trộn dưa kiệu,bí  đỏ nấu sườn,nước ép táo",||||,||||,,3.0
344,5d727364422d438f3fea95d3,"cá cơm kho tiêu,cải xào tỏi,canh khoai  môn nấu giò lợn,dưa hấu",||||,||||,,3.19
345,5d727365422d438f3fea95e0,"cháo trắng lá dứa,sinh tố  dâu",||,||,,4.0
346,5d727366422d438f3fea95e7,"bò xào cần,gỏi mít  non tôm thịt,canh khoai mỡ,mít ướp lạnh",||||,||||,,4.79
347,5d727360422d438f3fea95ae,"cá trê chiên giòn,giá xào hẹ,canh ngót  nấu bò,bánh flan",||||,||||,,3.71
348,5d727361422d438f3fea95b1,"lẩu nấm,chè hạt sen nhãn nhục",||,||,,3.35
349,5d727361422d438f3fea95b8,"cá thu chiên xốt cà,bông cải xanh trộn dầu hào,canh  khoai tím nấu tôm,sơ ri ướp lạnh",||||,||||,,3.56
350,5d727365422d438f3fea95de,"chả mực thì là,đậu  bắp xào nấm rơm,canh tần ô thịt bò,dưa hấu",||||,||||,,3.08
351,5d727366422d438f3fea95e6,"bún mọc,sữa tươi",||,||,,3.0
352,5d727361422d438f3fea95b0,"bún mọc,sữa đậu  phộng",||,||,,3.68
353,5d727363422d438f3fea95c7,"lẩu cá kèo, bún,sinh tố mãng cầu",||,||,,4.7
354,5d727363422d438f3fea95cb,"nui xào hải sản,sinh  tố xoài",||,||,,5.0
355,5d727364422d438f3fea95d5,"tép rim thịt heo,nấm bào ngư xào thịt heo,canh  khổ qua dồn cá thác lác,lê ướp lạnh",||||,||||,,2.36
356,5d727364422d438f3fea95d9,"sườn chua ngọt,rau lang xào tỏi,canh rau  mồng tơi nấu tôm khô,mận ướp lạnh",||||,||||,,3.0
357,5d727366422d438f3fea95ea,"cá nục hấp hành,cải  cuộn thịt bò,canh củ dền tôm thịt,dưa lưới",||||,||||,,2.53
358,5d727361422d438f3fea95b2,"mực dồn thịt chiên,hải sản xào rau củ,canh  khoai sọ nấu sườn,nước cam",||||,||||,,4.23
359,5d727362422d438f3fea95ba,"cá rô kho tộ,bông cải xanh xào cật lợn,rau  đay, mồng tơi nấu cua,chè hạnh nhân",||||,||||,,3.05
360,5d727362422d438f3fea95c3,"thịt bò xào sa tế,đậu rồng xào,canh ngót  nấu cá khoai,sinh tố đu đủ",||||,||||,,3.0
361,5d727365422d438f3fea95dd,"bánh mì bò kho,sữa đậu nành",||,||,,3.97
362,5d727367422d438f3fea95f0,"phở nghêu,chè hạt  sen nhãn nhục",||,||,,4.27
363,5d727367422d438f3fea95ee,"giò  heo hầm măng khô,bò xào tỏi tây,rau dền nấu thịt bằm,nước  ép ổi",||||,||||,,5.0
364,5d727369422d438f3fea95fc,"tép rang thịt ba chỉ,bò  trộn càng cua,canh giò sống nấu ngót,bánh chuối hấp",||||,||||,,3.0
365,5d72736d422d438f3fea9632,"canh thịt bò rau răm,nộm đu đủ xanh chả quế,cá thiều nướng muối ớt,nước ép cà rốt",||||,||||,,3.1
366,5d727369422d438f3fea95fd,"gỏi xoài tôm thịt,bò  xốt ngũ vị,canh gà nha đam,nước ép táo",||||,||||,,3.44
367,5d72736b422d438f3fea9617,"gà nấu lá giang,tôm xốt me,canh khoai mỡ,chè củ năng hạt lựu",||||,||||,,3.0
368,5d72736b422d438f3fea9621,"cá chẻm chiên xù,nấm tuyết xào gà,canh cải cúc nấu mọc,rau câu đậu xanh",||||,||||,,3.0
369,5d72736d422d438f3fea962f,"tôm xóc trứng muối,lầu cua đồng,nước cam",|||,|||,,3.78
370,5d72736a422d438f3fea9610,"bánh mì thịt quay,sữa chua dâu tây",||,||,,3.97
371,5d727367422d438f3fea95ef,"bánh nậm,sữa đậu phộng",||,||,,3.7
372,5d72736c422d438f3fea9629,"bò cuộn phô mai nướng,gỏi bạc hà,canh củ cải đỏ nấu sườn,sinh tố cà chua",||||,||||,,4.0
373,5d72736c422d438f3fea9625,"bánh mì nướng phô mai,sữa bắp",||,||,,3.75
374,5d72736d422d438f3fea962e,"xôi mặn,nước ép cà rốt",||,||,,3.86
375,5d72736d422d438f3fea9630,"mực dồn thịt chiên,rau muống xào tỏi,canh khoai sọ nấu sườn,chè đậu ván",||||,||||,,4.0
376,5d727368422d438f3fea95fa,"cua  rang me,bông hành xào tôm thẻ,canh cá thác lác cải thìa,kiwi  tươi",||||,||||,,4.0
377,5d727369422d438f3fea95fe,"cháo đậu đỏ,nước cam vắt",||,||,,4.53
378,5d72736a422d438f3fea960e,"cá nục hấp hành,bò xào cần tây,canh mít non lá lốt,nước dâu tằm",||||,||||,,3.2
379,5d72736a422d438f3fea9614,"ốc nhồi thịt,canh tần ô thịt bò,gỏi hoa chuối bò khô,sinh tố sa-pô-chê",||||,||||,,4.29
380,5d72736b422d438f3fea961a,"bún chả cá,chè mè đen",||,||,,3.82
381,5d72736b422d438f3fea961b,"bí đao xào thịt,ức gà xào nấm,canh củ sen hầm,nho tươi",||||,||||,,4.02
382,5d72736c422d438f3fea9626,"trứng cá thu hấp gừng,tép đồng cuốn bánh tráng,canh củ năng nấu sườn,sinh tố đu đủ",||||,||||,,4.23
383,5d72736c422d438f3fea962a,"thịt ba rọi chiên,hoa bí xào tỏi,canh tôm khoai mỡ,bánh khoai mì",||||,||||,,3.68
384,5d72736d422d438f3fea962d,"thịt xông khói xào măng tây,salad rau củ với trứng đà điểu luộc,canh rau dền thịt bằm,bánh flan",||||,||||,,4.15
385,5d727368422d438f3fea95f8,"bánh mì cá ngừ,nước ép cà  rốt",||,||,,4.0
386,5d72736d422d438f3fea9633,"mực khìa trái dừa,canh cải xanh cá thác lác,đậu phụ chiên xù,lê ướp lạnh",||||,||||,,4.0
387,5d727367422d438f3fea95ec,"bún chả cá,chè củ năng hạt  lựu",||,||,,4.0
388,5d727368422d438f3fea95f2,"cháo hến,nước ép bưởi",||,||,,4.0
389,5d727369422d438f3fea9600,"cá chạch kho gừng,bông  bí nhồi thịt,thác lác nấu riêu,chè hạt sen nhãn",||||,||||,,4.31
390,5d72736a422d438f3fea960c,"bò nấu tiêu xanh,bông thiên lý xào thịt bò,canh rau má tôm khô,dưa hấu ướp lạnh",||||,||||,,3.48
391,5d72736a422d438f3fea960f,"cá lóc kho xốt tương gừng,gỏi ngó sen chay,canh đậu hũ cà chua,dưa hoàng kim",||||,||||,,2.86
392,5d727368422d438f3fea95f4,"tôm hấp mía lau,bí  ngòi xào tỏi,canh rau muống me,rau câu hạnh nhân",||||,||||,,3.28
393,5d727368422d438f3fea95f5,"cơm tấm bì chay,sữa đậu nành",||,||,,3.27
394,5d72736a422d438f3fea9611,"trứng chiên hẹ với thịt gà,gỏi sứa,canh hẹ,chè chuối",||||,||||,,3.46
395,5d72736c422d438f3fea9622,"mì trứng xào hải sản,nước ép lê",||,||,,2.91
396,5d727367422d438f3fea95ed,"sườn  xào chua ngọt,gỏi tôm ngó sen,canh ngót nấu tôm,sươn  sáo",||||,||||,,3.51
397,5d727369422d438f3fea9601,"mì xào bò,nước ép thơm",||,||,,3.12
398,5d727369422d438f3fea9602,"bắp bò kho nghệ,cải  thìa xào nấm,canh óc heo táo đỏ, củ sen,chè đậu xanh  bột báng",||||,||||,,3.0
399,5d727369422d438f3fea9607,"cháo thịt thỏ,xoài ướp lạnh",||,||,,4.0
400,5d72736b422d438f3fea9620,"ếch rim sả ớt,xà lách trộn dầu giấm,canh chua tôm ngó sen,sinh tố cà chua",||||,||||,,4.33
401,5d72736c422d438f3fea9628,"bánh canh cua,sữa đậu nành",||,||,,3.86
402,5d727368422d438f3fea95fb,"cà ri nướng,sinh tố dừa",||,||,,3.73
403,5d72736a422d438f3fea9613,"cháo cá lóc,nước ép ổi",||,||,,3.7
404,5d72736b422d438f3fea961d,"cá kho tương bần,cải thìa xào tỏi,canh đậu đỏ nấu sườn,chè nhãn nhục",||||,||||,,3.44
405,5d72736c422d438f3fea9623,"đùi gà chiên muối sả,bông cải xanh xốt tóc tiên,canh chua cá kèo,dâu giằm sữa chua",||||,||||,,3.85
406,5d727368422d438f3fea95f6,"cá thu xốt xoài,bông  cải xào tôm,khổ qua xào trứng,dưa gang giằm",||||,||||,,4.06
407,5d727369422d438f3fea9603,"thịt  ba chỉ kho tàu,rau muống luộc,canh cua khoai môn,khoai  lang luộc",||||,||||,,4.03
408,5d727369422d438f3fea95ff,"ốc nấu chuối xanh,salad  táo,khổ qua nhồi thịt,sinh tố xoài",||||,||||,,4.51
409,5d727369422d438f3fea9608,"sườn ram,đậu cô-ve xào tôm,canh cải xooang thịt bằm,sinh tố bơ",||||,||||,,4.41
410,5d72736a422d438f3fea960d,"súp cua,trà mật ong",||,||,,4.0
411,5d72736a422d438f3fea9612,"cá điêu hồng kho thơm,canh chua cá thác lác,ngồng cải luộc,nước ép thơm",||||,||||,,3.0
412,5d72736b422d438f3fea961e,"lươn cuộn lá ngải đắng nướng,bông hẹ xào bò,canh khổ qua dồn thịt,xoài ướp lạnh",||||,||||,,3.32
413,5d72736c422d438f3fea9624,"bò rim,salad ớt chuông củ cải chua,canh củ dền hầm sườn,chè chuối",||||,||||,,3.65
