meal_id,actual_id,recipes,ingredients,methods,image,average_rating
0,5d64e24aa79b5707d353cb53,"thịt xiên nướng,đậu hũ chiên giòn,rau bí xào tỏi",|||,|||,https://cdn.eva.vn//upload/2-2015/images/2015-06-12/1434095666-11420169_470768229758961_1756024660_o.jpg,3.0
1,5d64e24aa79b5707d353cb54,"canh sườn nấu chua,đậu hũ sốt cà,rau muống luộc ăn kèm cà pháo,tép khô xào hành, khế",||||,||||,http://samtuoingoclinh.com/uploads/am-thuc/2015_07/mam-com-gia-dinh.jpg,3.93
2,5d64e24aa79b5707d353cb51,,,,https://znews-photo.zadn.vn/w960/Uploaded/jaroin/2018_06_15/com_7.jpg,4.6
3,5d64e24aa79b5707d353cb4f,,,,https://cdn.eva.vn/upload/3-2018/images/2018-07-18/9x-khoe-mam-com-4-nguoi-don-gian-nhung-bat-mat-khien-chong-khuyen-di-thi-vua-dau-bep-20-1531907294-384-width960height720.jpg,3.7
4,5d64e24ba79b5707d353cb58,"gà xào sả ớt,thịt bò xào cải xanh,canh chua tôm",|||,|||,http://media.sao247.com/news/2016/12/19/15.PNG,3.6
5,5d64e24aa79b5707d353cb50,"thịt vịt/gà quay,canh chua,trứng chiên,dưa chuột trộn",||||,||||,https://cdn.eva.vn/upload/3-2018/images/2018-07-18/9x-khoe-mam-com-4-nguoi-don-gian-nhung-bat-mat-khien-chong-khuyen-di-thi-vua-dau-bep-1-1531907293-171-width960height720.jpg,2.79
6,5d64e249a79b5707d353cb4d,"cá thu chiên mắm ngọt,mực xào bầu,canh tập tàng nấu tôm",|||,|||,http://media.sao247.com/news/2016/12/19/11.PNG,3.26
7,5d64e24aa79b5707d353cb4e,"thịt gà luộc chấm mắm,rau muống luộc,rau bí xào tỏi",|||,|||,https://cdn.eva.vn/upload/3-2018/images/2018-07-18/9x-khoe-mam-com-4-nguoi-don-gian-nhung-bat-mat-khien-chong-khuyen-di-thi-vua-dau-bep-2-1531907293-26-width960height960.jpg,3.39
8,5d64e24ba79b5707d353cb56,"mực xào chua ngọt,sườn non ram mặn,canh khổ qua nấu với thịt viên",|||,|||,http://media.sao247.com/news/2016/12/19/1532748513731718427013192637696418446992395n.jpg,3.0
9,5d64e24aa79b5707d353cb52,,,,https://cdn.eva.vn/upload/3-2018/images/2018-07-18/9x-khoe-mam-com-4-nguoi-don-gian-nhung-bat-mat-khien-chong-khuyen-di-thi-vua-dau-bep-19-1531907294-260-width960height720.jpg,3.0
10,5d64e24aa79b5707d353cb55,"đậu hũ chiên trứng,rau củ luộc chấm kho quẹt,canh chua nấu tôm",|||,|||,https://cdn.eva.vn//upload/2-2015/images/2015-05-12/1431421113-image1.jpg,1.79
11,5d64e24ba79b5707d353cb57,,,,https://znews-photo.zadn.vn/w960/Uploaded/jaroin/2018_06_15/banh_mi.jpg,3.39
12,5d64e24ba79b5707d353cb59,"canh bí nhồi thịt,cá om dưa cải,khổ qua xào trứng",|||,|||,https://znews-photo.zadn.vn/w960/Uploaded/jaroin/2018_06_15/com_9.jpg,3.53
13,5d30875c4d1d11b137160468,"cá kho tộ,đậu đũa luộc,chả cá sốt cà chua,cà muối",||||,||||,https://deptuoi30.com/wp-content/uploads/2019/04/thuc-don-bua-com-gia-dinh-6.jpg,3.8
14,5d3087594d1d11b137160464,"thịt ba chỉ luộc,đậu rim mắm,canh rau ngót nấu thịt,lòng gà xào nấm,cà muối",|||||,|||||,https://deptuoi30.com/wp-content/uploads/2019/04/thuc-don-bua-com-gia-dinh-2.jpg,3.44
15,5d30875d4d1d11b13716046e,"canh ngao,dưa cải muối chua,sườn xào chua ngọt,thịt xào ngồng tỏi,hoa quả tráng miệng",|||||,|||||,https://deptuoi30.com/wp-content/uploads/2019/04/thuc-don-bua-com-gia-dinh-11.jpg,3.55
16,5d30875d4d1d11b13716046c,"rau muống luộc,cá rán,thịt kho tàu,canh cá nấu chua",||||,||||,https://deptuoi30.com/wp-content/uploads/2019/04/thuc-don-bua-com-gia-dinh-10.jpg,3.63
17,5d30875a4d1d11b137160465,"đậu rán chấm mắm tôm,gà rang,lạc rang,rau thơm ăn kèm",||||,||||,https://deptuoi30.com/wp-content/uploads/2019/04/thuc-don-bua-com-gia-dinh-3.jpg,3.58
18,5d30875e4d1d11b137160472,"tôm nõn rim mắm,canh chua,cải thảo luộc,dưa chuột góp,sườn sụn xào",|||||,|||||,https://deptuoi30.com/wp-content/uploads/2019/04/thuc-don-bua-com-gia-dinh-16.jpg,3.6
19,5d30875d4d1d11b13716046b,"rau bí luộc,sườn xào dứa,canh bầu nấu ngao,đậu rán",||||,||||,https://deptuoi30.com/wp-content/uploads/2019/04/thuc-don-bua-com-gia-dinh-9.jpg,3.52
20,5d30875c4d1d11b137160469,"đậu cove xào lòng,thịt gà rang gừng,bí xanh luộc chấm vừng",|||,|||,https://deptuoi30.com/wp-content/uploads/2019/04/thuc-don-bua-com-gia-dinh-7.jpg,3.54
21,5d30875d4d1d11b13716046a,"dưa cải muối chưa,canh mướp lòng gà,thịt ba chỉ kho tàu,lạc rang muối,rau muống luộc",|||||,|||||,https://deptuoi30.com/wp-content/uploads/2019/04/thuc-don-bua-com-gia-dinh-8.jpg,3.76
22,5d30875b4d1d11b137160467,"đậu rán giòn,cá rô rán giòn,canh cua cà muối,rau muống luộc,lòng lợn luộc",|||||,|||||,https://deptuoi30.com/wp-content/uploads/2019/04/thuc-don-bua-com-gia-dinh-5.jpg,3.96
23,5d30875a4d1d11b137160466,"ốc nấu đậu,đậu sốt cà chua,cá rô rán giòn,rau mồng tơi luộc",||||,||||,https://deptuoi30.com/wp-content/uploads/2019/04/thuc-don-bua-com-gia-dinh-4.jpg,3.75
24,5d30875d4d1d11b13716046d,"canh cua cà muối,mướp xào thịt lợn,su su luộc,thịt lợn rang",||||,||||,https://deptuoi30.com/wp-content/uploads/2019/04/thuc-don-bua-com-gia-dinh-12.jpg,3.43
25,5d30875d4d1d11b137160470,"canh xương,bí ngô xào tỏi,thịt lợn luộc,hoa quả tráng miệng",||||,||||,https://deptuoi30.com/wp-content/uploads/2019/04/thuc-don-bua-com-gia-dinh-14.jpg,3.69
26,5d30875e4d1d11b137160471,"thịt chân giò luộc,canh mướp,canh cá nấu chua,đậu đũa xào lòng",||||,||||,https://deptuoi30.com/wp-content/uploads/2019/04/thuc-don-bua-com-gia-dinh-15.jpg,3.6
27,5d30875f4d1d11b137160473,"thịt ba chỉ chiên giòn,chanh cá nấu chua,cá rán giòn,rau sống ăn kèm",||||,||||,https://deptuoi30.com/wp-content/uploads/2019/04/thuc-don-bua-com-gia-dinh-18.jpg,3.59
28,5d30875d4d1d11b13716046f,"cá rán giòn,canh cá chua,đậu đũa xào",|||,|||,https://deptuoi30.com/wp-content/uploads/2019/04/thuc-don-bua-com-gia-dinh.jpg,3.01
29,5d3087584d1d11b137160463,"canh mướp đắng nhồi thịt,salad rau,thịt ba chỉ luộc,ốc móng tay xào",||||,||||,https://deptuoi30.com/wp-content/uploads/2019/04/thuc-don-bua-com-gia-dinh-1.png,3.28
30,5cbf3c91a29e122e4c79a972,"thịt chân giò luộc,cá rô rán,đậu bắp xào tỏi,rau muống luộc","Mướp: 2 quả. Tôm: 3,5 lạng. Tỏi, ớt. Các loại gia vi cần dùng cho món ăn như sau: đường, nước mắm, dầu ăn, xì dầu, nước cốt chanh|Mướp: 2 quả. Tôm: 3,5 lạng. Tỏi, ớt. Các loại gia vi cần dùng cho món ăn như sau: đường, nước mắm, dầu ăn, xì dầu, nước cốt chanh|Mướp: 2 quả. Tôm: 3,5 lạng. Tỏi, ớt. Các loại gia vi cần dùng cho món ăn như sau: đường, nước mắm, dầu ăn, xì dầu, nước cốt chanh|Mướp: 2 quả. Tôm: 3,5 lạng. Tỏi, ớt. Các loại gia vi cần dùng cho món ăn như sau: đường, nước mắm, dầu ăn, xì dầu, nước cốt chanh|","Trước tiên, tôm sau khi mua về các bạn đem lột vỏ rồi rút chỉ ở sống lưng nhưng chừa lại phần đuôi tôm để món ăn được đẹp mắt nhé, sau đó mang đi rửa sạch.; Mướp đem gọt sạch vỏ rồi rửa sạch, thái thành những đoạn dài tầm 5cm rồi dùng dao nạo bỏ phần ruột bên trong.; Lần lượt cho từng con tôm vào bên trong từng quả mướp sao cho phần đuôi tôm ngửa lên trên để món ăn được đẹp mắt nhé.; Sau khi tiến hành nhồi tôm vào mướp xong các bạn đem cho vào nồi hấp. Thực hiện hấp trong vòng 10 phút đến khi tôm chín chuyển thành màu đỏ tươi đẹp là đạt yêu cầu, cho ra được.; Chúng ta sẽ pha nước chấm để ăn kèm với món ăn theo công thức sau: cho vào một bát con 1 thìa dầu ăn, 1 thìa con đường, 1 thìa con xì dầu, 4 thìa nước mắm ngon, ít tỏi ớt băm. Khuấy dều hỗn hợp này lên cho đồng nhất rồi rưới đều lên món ăn. Có thể trang trí bằng vài cọng rau ngò hay ớt thái khoanh cũng rất đẹp đấy nhé.|Trước tiên, tôm sau khi mua về các bạn đem lột vỏ rồi rút chỉ ở sống lưng nhưng chừa lại phần đuôi tôm để món ăn được đẹp mắt nhé, sau đó mang đi rửa sạch.; Mướp đem gọt sạch vỏ rồi rửa sạch, thái thành những đoạn dài tầm 5cm rồi dùng dao nạo bỏ phần ruột bên trong.; Lần lượt cho từng con tôm vào bên trong từng quả mướp sao cho phần đuôi tôm ngửa lên trên để món ăn được đẹp mắt nhé.; Sau khi tiến hành nhồi tôm vào mướp xong các bạn đem cho vào nồi hấp. Thực hiện hấp trong vòng 10 phút đến khi tôm chín chuyển thành màu đỏ tươi đẹp là đạt yêu cầu, cho ra được.; Chúng ta sẽ pha nước chấm để ăn kèm với món ăn theo công thức sau: cho vào một bát con 1 thìa dầu ăn, 1 thìa con đường, 1 thìa con xì dầu, 4 thìa nước mắm ngon, ít tỏi ớt băm. Khuấy dều hỗn hợp này lên cho đồng nhất rồi rưới đều lên món ăn. Có thể trang trí bằng vài cọng rau ngò hay ớt thái khoanh cũng rất đẹp đấy nhé.|Trước tiên, tôm sau khi mua về các bạn đem lột vỏ rồi rút chỉ ở sống lưng nhưng chừa lại phần đuôi tôm để món ăn được đẹp mắt nhé, sau đó mang đi rửa sạch.; Mướp đem gọt sạch vỏ rồi rửa sạch, thái thành những đoạn dài tầm 5cm rồi dùng dao nạo bỏ phần ruột bên trong.; Lần lượt cho từng con tôm vào bên trong từng quả mướp sao cho phần đuôi tôm ngửa lên trên để món ăn được đẹp mắt nhé.; Sau khi tiến hành nhồi tôm vào mướp xong các bạn đem cho vào nồi hấp. Thực hiện hấp trong vòng 10 phút đến khi tôm chín chuyển thành màu đỏ tươi đẹp là đạt yêu cầu, cho ra được.; Chúng ta sẽ pha nước chấm để ăn kèm với món ăn theo công thức sau: cho vào một bát con 1 thìa dầu ăn, 1 thìa con đường, 1 thìa con xì dầu, 4 thìa nước mắm ngon, ít tỏi ớt băm. Khuấy dều hỗn hợp này lên cho đồng nhất rồi rưới đều lên món ăn. Có thể trang trí bằng vài cọng rau ngò hay ớt thái khoanh cũng rất đẹp đấy nhé.|Trước tiên, tôm sau khi mua về các bạn đem lột vỏ rồi rút chỉ ở sống lưng nhưng chừa lại phần đuôi tôm để món ăn được đẹp mắt nhé, sau đó mang đi rửa sạch.; Mướp đem gọt sạch vỏ rồi rửa sạch, thái thành những đoạn dài tầm 5cm rồi dùng dao nạo bỏ phần ruột bên trong.; Lần lượt cho từng con tôm vào bên trong từng quả mướp sao cho phần đuôi tôm ngửa lên trên để món ăn được đẹp mắt nhé.; Sau khi tiến hành nhồi tôm vào mướp xong các bạn đem cho vào nồi hấp. Thực hiện hấp trong vòng 10 phút đến khi tôm chín chuyển thành màu đỏ tươi đẹp là đạt yêu cầu, cho ra được.; Chúng ta sẽ pha nước chấm để ăn kèm với món ăn theo công thức sau: cho vào một bát con 1 thìa dầu ăn, 1 thìa con đường, 1 thìa con xì dầu, 4 thìa nước mắm ngon, ít tỏi ớt băm. Khuấy dều hỗn hợp này lên cho đồng nhất rồi rưới đều lên món ăn. Có thể trang trí bằng vài cọng rau ngò hay ớt thái khoanh cũng rất đẹp đấy nhé.|",http://elinerfood.com/wp-content/uploads/2016/05/mam-com-6-365-mam-com-gia-dinh.jpg,3.46
31,5cbf3c95a29e122e4c79a973,"hoa thiên lý xào thịt bò,cá rô chiên xù,dưa xào,đỗ luộc","Thịt bò phi lê: 200g. Tôm sú: 150g. Hoa thiên lý: 400g. Nấm trâm vàng (hoặc nấm rơm đều được): 150g. Hành lá, ngò rí: 50g. Ớt sừng: 3 quả. Hành khô, tỏi: 50g. Các loại gia vị cần dùng cho món ăn: hạt nêm, bột ngọt, đường, nước mắm, dầu ăn, hạt tiêu||||","Hành khô, tỏi lần lượt lột vỏ rồi băm nhuyễn, để riêng từng loại.; Thịt bò phi lê mua về các bạn rửa sạch rồi thái thành những lát mỏng theo thớ ngang để khi ăn sẽ không bị dai. Sau đó tiến hành ướp thịt cùng 1 thìa hành tỏi băm, 1/2 thìa hạt nêm, 1/3 thìa bột ngọt, 1/3 thìa hạt tiêu, 1 thìa dầu ăn. Trộn đều lên và để hỗn hợp này trong 15 phút cho ngấm kĩ.; Tôm sú các bạn cũng đem rửa sạch rồi lột bỏ vỏ, bỏ đầu, giữ lại phần đuôi và rút chỉ ở sống lưng. Tiếp đến đem ướp tôm cùng 1 thìa nước mắm, ½ thìa bột ngọt, ¼ thìa đường, ½ thìa dầu ăn, ¼ thìa hạt tiêu, trộn đều cho ngấm kĩ gia vị và để trong 15 phút.; Bắc chảo lên bếp rồi cho vào ít dầu ăn để phi thơm hành tỏi băm đến dậy mùi thì cho tôm vào, xào nhẹ tay trên ngọn lửa to vài lượt đến khi tôm gần săn lại thì tiếp tục cho hoa thiên lý vào. Nêm thêm 1 thìa hạt nêm, ½ thìa bột ngọt sao cho vừa miệng ăn. Lúc này các bạn cho thịt bò vào xào đều tay khoảng 4 phút thì nhanh tay cho hành lá, ngò rí và rắc ít hạt tiêu lên, đảo đều rồi tắt bếp luôn.; Trình bày món ăn ra đĩa rồi trang trí lên bằng những lát ớt thái mỏng cho thêm bắt mắt và thưởng thức luôn khi còn nóng nhé.||||",http://elinerfood.com/wp-content/uploads/2016/05/mam-com-7-365-mam-com-gia-dinh.jpg,3.57
32,5cbf3ccba29e122e4c79a97c,"tôm hấp sả,rau muống xào tỏi,canh rau mồng tơi nấu ngao,cà dầm nước mắm",||||,||||,http://elinerfood.com/wp-content/uploads/2016/05/mam-com-16-365-mam-com-gia-dinh.jpg,2.95
33,5cbf3ccba29e122e4c79a97b,"thịt ba chỉ rang cháy cạnh,cà tím xào,canh khoai sọ nấu thịt gà,đậu phụ luộc",400 gam thịt ba chỉ. 3 củ sả. 1 thìa mắm tôm. 1 thìa nước mắm. ½ thìa đường. Hành khô||||,"Bước đầu tiên, thịt ba chỉ sau khi mua về các bạn có thể lọc bỏ phần da hay giữ lại đều đưọc, tùy theo sở thích của nhà bạn. Sau đó đem đi rửa sạch rồi tiến hành thái những miếng cỡ vừa ăn.; Hành khô lột vỏ rồi đập dập.; Bắc chảo lên bếp rồi cho vào ít dầu ăn. Đợi dầu nóng thì cho thịt vào rang đều tay trên ngọn lửa vừa. Đến khi thấy thịt săn lại chuyển snag màu ngả vàng thì trút sả vào, đảo đều lên. Thấy thịt đã xém cạnh tức là đạt yêu cầu rồi.; Cho hành khô đập dập vào cùng đảo cùng vài lượt rồi tiếp tục cho chút nước mắm, đường. Rang đều lên cho thịt ngấm kĩ gia vị khoảng 5 phút là có thể tắt bếp được.||||",http://elinerfood.com/wp-content/uploads/2016/05/mam-com-15-365-mam-com-gia-dinh.jpg,3.75
34,5cbf3cbfa29e122e4c79a979,"sườn xào chua ngọt,măng xào,canh bí nấu thịt gà,dưa chuột chẻ",Sườn thăn non: 500g. 1 – 2 củ hành khô. 4 – 5 tép tỏi. Dấm táo. Đường. Nước ép táo. Xì dầu||||,"Bạn nên chọn những dẻ sườn thăn có nhiều sụn, nhiều nạc, ít mỡ sẽ khiến món ăn ngon hơn và đậm vị hơn. Trước hết, bạn cần chặt sườn thành các miếng vừa ăn, sau đó cho vào nồi luộc qua cho sạch các chất bẩn có trong sườncùng chút muối. Sau khi luộc sườn xong, đem ra rửa với nước lạnh và để ráo nước.; Hành tỏi bóc vỏ, băm nhỏ.; Cho sườn vào nồi, đổ nước ngập sườn. Khi nước sôi thì hạ lửa vừa, đun đến khi nước cạn còn khoảng ½ bát ăn cơm thì gắp sườn ra đĩa, giữ lại nước luộc sườn, để riêng ra một bát sạch.; Bắc chảo lên bếp, co hai thìa dầu ăn vào (tốt nhất là chống dính, để rán sườn). Đợi dầu sôi thì cho ½ chỗ hành tỏi băm vào phi thơm đến khi chuyển sang màu nâu vàng thì chắt hết dầu và hành tỏi đi để khi rán sườn hành tỏi không bị cháy đen.; Cho sườn vào chảo rán bằng dầu vừa phi hành tỏi. Để lửa vừa, bạn chỉ cần rán sườn sao cho miếng sườn xém cạnh là được. Sườn rán xong bạn để ra đĩa sạch riêng.; Dùng chỗ nước luộc sườn còn sót lại, pha thêm hai thìa nước lã, bốn thìa dấm, ba thìa nước ép táo và đường tùy theo khẩu vị. Có thể cho thêm xì dầu hoặc bột canh nếu cảm thấy sườn chưa đủ mặn. Yêu cầu nước sốt phải có đủ vị chua, ngọt, hơi mặn.; Xếp sườn vào chảo, đổ nước sốt chua ngọt vảo. Đun lửa vừa, thỉnh thoảng đảo đều sườn cho sườn ngấm sốt. Đun đến khi nước sốt hơi sền sệt, quyện dính vào sườn là xong rồi.||||",http://elinerfood.com/wp-content/uploads/2016/05/mam-com-13-365-mam-com-gia-dinh.jpg,4.15
35,5cbf3cd3a29e122e4c79a97f,"gà hấp lá chanh,canh khoai sọ nấu xương,rau muống luộc,nước mắm tỏi ớt",||||,||||,http://elinerfood.com/wp-content/uploads/2016/05/mam-com-19-365-mam-com-gia-dinh.jpg,3.0
36,5cbf3ca2a29e122e4c79a975,"cá hồi kho tiêu,cà tím tẩm bột chiên,măng tây xào bơ tỏi,rau muống luộc","1 khúc cá hồi: khoảng 250g. Tỏi băm. Ớt tươi. 2 thìa canh đường. 1 thìa cà phê muối. 1 thìa canh dầu ăn. 1 thìa canh nước mắm. Hạt tiêu, hành, nước màu|2 quả cà tím (các bạn chọn mua những quả cà tím còn non nhé). 1 túi bột chiên giòn. Nước xốt. Tỏi, ớt, gừng băm nhỏ. 2 lá bắp cải. Hành lá, giấm, đường, gia vị|400 gam măng tây. 2 củ tỏi. 30 gam bơ. Các loại gia vị cần được dùng cho món ăn: dầu hào,nước mắm, bột ngọt||","Để có được món ăn ngon thì ở bước làm đầu tiên, cá hồi sau khi mua về các bạn đem đi rửa sạch rồi để cho ráo nước. Hoặc dùng giấy mềm để thấm nước cho nhanh khô đều được.; Bắc nồi lên bếp để tiến hành kho cá. Các bạn cho cá hồi vào rồi lần lượt cho các loại gia vị vào: hạt tiêu, ớt, dầu ăn, đường, muối, tỏi và nước màu. Dùng đũa đảo đều lên để cá ngấm kĩ gia vị ướp và để trong khoảng thời gian là 20 phút nhé.; Sau khi đủ thời gian ướp cá rồi, các bạn bật bếp, để lửa lớn. Kho đến khi phần nước trong nồi sôi nhẹ thì hạ nhỏ lửa xuống đun liu riu. Có thể thêm vào vài lát ớt nếu bạn ăn được cay cũng rất ngon đấy nhé.; Thỉnh thoảng các bạn mở vung ra để xem nước đã cạn chưa thì thêm vào 2 thìa canh nước nóng để kho cá không bị cháy. Lưu ý là nước nóng nhé các bạn, nếu cho nước lạnh vào cá sẽ bị tanh.; Thỉnh thoảng lật mặt cá để cả hai mặt cùng ngấm đều gia vị. Đun đến khi phần nước sánh lại là đạt yêu cầu, các bạn tắt bếp luôn. Rắc lên món ăn chút hạt tiêu và hành lá thái nhỏ cho thêm bắt mắt và dậy mùi là đã hoàn thành xong rồi.|Trước hết, cà tím mua về các bạn đem rửa sạch rồi xắt thành những khúc dài tầm 5cm. Sau đó bạn hãy khéo léo loại bỏ phần vỏ tím cứng bên ngoài rồi lại xắt theo chiều dọc thành những miếng dài nhé. Ngâm trong nước muối pha loãng khoảng 15 phút để cà không bị thâm rồi nhanh chóng vớt ra cho ráo nước.; Đổ sẵn bột chiên giòn ra đĩa rồi trộn vào cùng ít muối. Sau đó lần lượt cho từng miếng cà tím lăn vào đĩa này sao cho bột phủ kín miếng cà là được nhé.; Các bạn chuẩn bị sẵn một chiếc chảo sâu lòng rồi bắc lên bếp, đổ vào chút dầu ăn. Đợi lúc dầu sôi già thì thả từng miếng cà tím đã lăn bột vào chiên ngập dầu sao cho cả hai mặt đều vàng đều thì gắp ra đĩa có lót sẵn giấy thấm dầu.; Bắc cải các bạn xắt thành những sợi nhỏ rồi bày lên đĩa để xếp cà tím lên.; Tiến hành làm nưóc sốt cho món ăn như sau: các bạn đổ bớt dầu ăn vừa chiên cà tím ra rồi cho ớt, gừng bằm nhuyễn vào, xào lên thật đều tay vài lượt thì cho tiếp chút đường, ít nước xốt vào, tiếp tục đảo nhanh tay đến khi hỗn hợp sánh đặc lại thì tắt bếp luôn. Thêm ít hành lá thái nhỏ. Rưới đều phần hỗn hợp này lên món ăn và thưởng thức luôn nhé các bạn.|Măng tây sau khi mua về các bạn đem rửa sạch rồi loại bỏ phần sơ ở dưới gốc đi. Tiếp đến chúng ta xắt măng tây thành những đoạn dài khoảng 8cm nhé. Và để giữ cho măng có được vị ngon và xanh rau thì có một mẹo hay đó là: các bạn hãy cho măng tây vào trần sơ qua với nước sôi có thêm vào chút muối rồi nhanh chóng vớt ra chậu nước lạnh, rửa sạch lại.; Tỏi lột bỏ vỏ rồi băm nhỏ.; Vẫn phần bơ có sẵn trong chảo các bạn cho măng tây vào xào cùng. Thêm chút dầu hào vào rồi đảo đều lên cho ngấm đều gia vị. Chúng ta chỉ cần xào đến khi măng tây ngấm kĩ gia vị là được, sau đó tắt bếp luôn nhé vì trước đó măng đã được trần qua với nước sôi rồi nên không cần xào kĩ quá sẽ làm mất đi độ giòn của món ăn.; Trình bày món ăn ra đĩa rồi rắc lên phần tỏi phi sao cho đẹp mắt và thưởng thức ngay thành quả của mình khi còn nóng nhé.||",http://elinerfood.com/wp-content/uploads/2016/05/mam-com-9-365-mam-com-gia-dinh.jpg,3.84
37,5cbf3cd3a29e122e4c79a97e,"thịt lợn xào sả ớt,canh dưa thịt bò,rau bắp cải luộc,nước mắm dầm trứng","Thịt lợn chọn ngon: 300 gam. Sả, ớt, tỏi. Các loại gia vị cần sử dụng cho món ăn: muối, hạt tiêu, dầu ăn, dầu hào|300 gam thịt bò bắp hay thịt bò gân đều được. Dưa cải chua. 2 quả cà chua chín. Hành khô, muối, nước mắm, hạt nêm|||","Sả và ớt đem rửa sạch rồi thái nhỏ.; Thịt lợn mua về các bạn rửa với nước muối pha loãng cho sạch khuẩn rồi mang đi rửa lại bằng nước sạch. Dùng khăn mềm thấm đỡ nước.Tiếp đến các bạn thái thịt thành những miếng mỏng cỡ vừa ăn.; Thực hiện công đoạn ướp thịt như sau: cho thịt vào âu nhựa to tồi thêm vào chút dầu hào, sả ớt, muối và hạt tiêu. Trộn đều hỗn hợp này cho ngấm kĩ gia vị và để nguyên trong 15 phút.; Cho chảo lên bếp rồi đổ vào ít dầu ăn. Đợi khi dầu nóng già ta cho tỏi băm vào phi thơm lên đến dậy mùi thì mới cho thịt, đảo đều tay đến khi thịt săn lại hơi chín thì nếm xem khẩu vị đã vừa miệng ăn chưa để điều chỉnh lại. Để lửa nhỏ cho thịt được chín đều nhé các bạn. Nếu gia đình bạn ăn được cay thì thêm vào chút ớt sa tế cũng rất ngon. Lúc này khi thịt đã chín mểm rồi các bạn nhanh tay cho hành tây vào, đảo lên vài lượt là có thể tắt bếp được.|Trước tiên, với dưa cải chua các bạn cần đem rửa sạch với nhiều lần nước để cho bới đi độ chưa. Tiếp đến chúng ta xắt dưa thành những khúc ngắn cỡ vừa rồi để ra rổ cho ráo nhé.; Thịt bò các bạn đem rửa cùng nước muối loãng cho sạch vi khuẩn rồi rửa lại bằng nước sạch, để ráo bớt nước sau đó đem bảo quản trong ngăn đông tủ lạnh khoảng nửa tiếng để thịt se lại sẽ dễ thái hơn nhé. Thái thành những lát mỏng vừa ăn.; Bắc một nồi lên bếp rồi cho thịt bò đã thái vào. Đổ vào lượng nước sao cho ngập mặt thịt rồi đun đến khi thịt mềm khoảng 20 phút thì nhanh chóng cho dưa cải chua vào, đun thêm 5 phút nữa rồi tắt bếp.; Bắc một chảo con lên bếp rồi cho vào ít dầu ăn để phi thơm hành khô cùng cà chua đến khi cà chua nát nhuyễn chín mềm thì thêm vào ít muối.; Đổ cà chua vừa phi vào trong nồi dưa thịt bò, tiếp tục đun sôi trở lại thêm 5 phút thì nêm vào 2 thìa cà phê nước mắm, nửa thìa cà phê muối, nửa thìa cà phê hạt nêm. Khi tất cả nguyên liệu đã chín nhừ rồi là bạn có thể tắt bếp luôn được.|||",http://elinerfood.com/wp-content/uploads/2016/05/mam-com-18-365-mam-com-gia-dinh.jpg,3.49
38,5cbf3c95a29e122e4c79a974,"bò xào đậu,rau muống xào tỏi,ngao hấp sả,bí xanh luộc",||||,||||,http://elinerfood.com/wp-content/uploads/2016/05/mam-com-8-365-mam-com-gia-dinh.jpg,3.39
